RBR-8hmb2r,"29 May 2023","Studying the progression and the consequences of the new Coronavirus in Brazil","Multicenter study of the natural history of the new Coronavirus SARS-CoV-2 in Brazil                                                                                                                                                                                                                                                                                                                                                                                                                                                                                                                                                                                                                                                                                                                                                                                                                                                                                                                                                                                              ",,"Instituto Nacional de Infectologia Evandro Chagas/Fundacao Oswaldo Cruz (INI/Fiocruz)",27/07/2020,"  20200727","10/13/2025 15:56:09",REBEC,http://ensaiosclinicos.gov.br/rg/RBR-8hmb2r,"Not Recruiting",No,,,-,03/08/2020,,Observational,"A prospective observational analytic cohort study <br><br>",N/A,Brazil,"José ",Moreira,"Av Brasil 4365 Manguinhos, Hospital Evandro Chagas, sala 110, terreo",josemoreyyra@gmail.com,+55(21)970358843,"Instituto Nacional de Infectologia Evandro Chagas/Fundacao Oswaldo Cruz (INI/Fiocruz)","Inclusion criteria: Age equal to or greater than 18 years;<br>Patients with fever and/or respiratory symptoms within 7 days;<br>Contacts of patients with a flu-like syndrome<br>","Exclusion criteria: Patients who are unable to participate in study visits.<br>Patients with severe mental disorders or those from whom the collection of information due to communication disorders or lack of fluency in Portuguese or another language understood by the attending physician is impossible.<br>","Coronavirus disease 2019; Betacoronavirus; Pneumonia; Severe acute respiratory syndrome;C01.925.782.600.550.200;C01.748.730;C01.748.610;B04.820.504.540.150.113","The prospective cohort of patients with suspected influenza-like illness (defined as the occurrence of fever and respiratory symptoms) and household contacts will undergo thorough clinical and laboratory evaluation that includes testing for respiratory virus infections and other conditions considered relevant. Subjects with a confirmed diagnosis of COVID-19 will be followed up in the participating centers of the study.<br><br>Recruitment of non-hospitalized patients<br>Patients with clinical suspicion of the flu-like syndrome will be evaluated consecutively and will be invited to participate in the study, and will be included after signing the Informed Consent Form (ICF). After inclusion (D0), the team will perform the clinical evaluation and record the sociodemographic and epidemiological data, symptoms, and activities, as well as information regarding the use of medications and other therapeutic strategies. Biological samples will be collected for laboratory tests and storage in the biorepository, according to the study protocol. Scheduled visits will occur for all participants on D14+/-3, D21+/-3, D28+/-3, D56+/-7, D128+/-7, D168+/-7, and d336+/-7 after the onset of symptoms. On these visits, the same instruments will be applied, and biological samples will be collected. Non-scheduled visits for the study may take place under the following conditions: 1) significant worsening of the respiratory condition; 2) adverse event in the instituted treatment; 3) decompensation of an underlying disease; 4) at the discretion of the study team (e.g., reassessment). On these unscheduled visits, in addition to the instruments defined for scheduled visits, a questionnaire will also be applied that contemplates the cause of unscheduled visits. Additional tests may be requested by th;Other;V03.175.500;E05.318.308.980.438;N02.278.065.200","We expect to evaluate the natural history of the new coronavirus SARS-CoV-2 in Brazil","We expect to describe the clinical manifestations of SARS-CoV-2 infection and its evolution in patients followed in different states of the Brazilian territory;We expect to investigate the risk factors and prognoses associated with severity, focusing on severe acute respiratory syndrome;We expect to correlate immunological, genetic and virological aspects with clinical manifestations and severity in patients with COVID-19;We expect to investigate the relationship between polymorphisms in human proteins that participate in the interaction with SARS-CoV-2 with susceptibility and clinical evolution of COVID-19;We expect to predict, from the use of machine learning techniques, patients who will evolve to the severe form of the disease;We expect to investigate the prevalence of active and previous infection in symptomatic and asymptomatic households contacts;We expect to determine the average incubation period and rate of infectivity in households contacts;We expect to analyze the phylogenetic relationship between viral isolates identified in Brazil with other countries of the world;We expect to verify the occurrence of transmission networks among individuals infected with SARS-CoV-2;We expect to describe and estimate the socioeconomic and psychosocial impact of SARS-CoV-2 infection;We expect to describe the main sequelae in recovered patients;We expect to constitute a biorepository of clinically characterized samples that can be shared for the evaluation of diagnostic tests and biomarkers that advance the understanding and better clinical-therapeutic management of patients with SARS-CoV-2 infection;We expect to investigate the seroprevalence of SARS-CoV-2 in blood banks over 12 weeks in different regions of Brazil;We expect to investigate the seroprevalence of SARS-CoV-2 in health professionals;We expect to compare seroprevalence according to gender, age groups, and social characteristics;We expect to create serological and molecular panels to be used exclusively in public health action, using the samples of the biorepository;We expect to evaluate the performance and applicability of the RDT DPP ® COVID-19 IGM/IGG – Bio-Manguinhos rapid test, among others, for the diagnosis of the new Coronavirus SARS-CoV-2;We expect to design, through mathematical modeling, the number of patients, deaths, and number of beds needed in the states and in Brazil as a whole;We expect to identify which isolation measures are needed and for how long they are needed in the different states and in Brazil as a whole;We expect to develop a real-time model adjusted by mobility parameters, seasonality, and seroepidemiological surveys over time in different states and in Brazil as a whole;We expect to create a dashboard for managers and health departments with metrics and parameters used in the developed real-time model",,"Conselho Nacional de Desenvolvimento Científico e Tecnológico (CNPQ);Departamento de Ciência e Tecnologia do Ministério da Saúde","Instituto Nacional de Infectologia Evandro Chagas/Fundacao Oswaldo Cruz (INI/Fiocruz)",,,,,,,,,,,,,,,,,,,Yes,False,"          "
RBR-9gm9bz,"29 May 2023","Determining factors of prognosis and morbidity in Chronic Chagas Heart Disease - phase III","Determining factors of prognosis and morbidity in Chronic Chagas Heart Disease - phase III - DCHD: Dilated Chagasic Heart Disease                                                                                                                                                                                                                                                                                                                                                                                                                                                                                                                                                                                                                                                                                                                                                                                                                                                                                                                                                                        ",,"Universidade Federal de Minas Gerais",12/06/2020,"  20200612","10/13/2025 15:56:09",REBEC,http://ensaiosclinicos.gov.br/rg/RBR-9gm9bz,Recruiting,No,30Y,60Y,-,03/02/2020,,Intervention,"Prognostic clinical trial, open, with single arm",3,Brazil,"Manoel ","Rocha ","Av. Prof. Alfredo Balena, 190",rochamoc@terra.com.br,+553134099641,"Faculade de Medicina da UFMG","Inclusion criteria: Diagnosis of Chagas disease by at least two of the three positive serological tests for Trypanosoma cruzi (indirect immunofluorescence, indirect hemoglutination and ELISA). Present a stable clinical condition, defined as no acute exacerbation of heart disease in the last three months. Presence of cardiac involvement defined, on echocardiogram, by the presence of left ventricular dysfunction (ejection fraction lower 52% for males and 54% for females). Presence of clinical signs and symptoms of heart failure (NYHA II and III). Not being a smoker and denying routine exposure to smoking<br>Presence of inspiratory muscle weakness defined with maximum inspiratory pressure values lower 70% of predicted. Be aged between 30 and 60 years. Be sedentary according to the International Physical Activity Questionnaire (IPAQ). Not having previous episodes of stroke and not having pulmonary, renal pathologies, musculoskeletal limitations and diabetes mellitus, conditions that alter the ability to perform functional tests.","Exclusion criteria: Warm-up activities before carrying out stress tests as well as any other contraindications to the maximum and submaximal tests.<br>Failure to perform the study's evaluation procedures. Only for the experimental group: do not perform inspiratory muscle training for two days in the same week (at home) or are absent from two supervised sessions during training.","Cardiovascular diseases; Heart Diseases; Ventricular Dysfunction;C14.280;C14.280.945","Experimental group: 15 volunteers (male or female) diagnosed with Chagas 'disease with Chagas' dilated cardiomyopathy and inspiratory muscle weakness. They will perform inspiratory muscle training for 12 weeks (3 months) 7 times a week lasting 30 minutes a day. Physically pre and post intervention will be evaluated by the cardiopulmonary stress test, 6-minute walk test, respiratory muscle strength. In addition to 3 questionnaires related to quality of life, dyspnea assessment and one specific to heart failure.<br>Control group: 15 volunteers (male or female) diagnosed with Chagas disease presenting dilated chagasic cardiomyopathy and inspiratory muscle weakness. They will not perform inspiratory muscle training, but will be physically assessed pre and post 12 weeks by the cardiopulmonary stress test, 6-minute walk test, respiratory muscle strength. In addition to 3 questionnaires related to quality of life, dyspnea assessment and one specific to heart failure.;Device;Behavioural;Other;E02.760.169.063.500.185;E02.760.169.063.500.387;G11.427.410.698.277.311","Improvement of post-intervention cardiorespiratory capacity, as assessed by the cardiopulmonary stress test.;Increased post-intervention inspiratory muscle strength, assessed by manovacuometry.;Increase in the distance covered by the 6-minute walk test by at least 50 meters.;Improved perception of quality of life, as assessed by the SF-36 and MLwHFQ questionnaires.;Improvement of dyspnea during their activities of daily living, assessed by the MRC instrument.","Check the adherence rate of the sessions during the weeks of inspiratory muscle training, through presence at the clinic and follow-up booklet.;Monitor adverse events such as hospitalization, stroke and death monthly after twelve weeks of supervised telephone contact.",,"Universidade Federal de Minas Gerais","Universidade Federal de Minas Gerais",,,,,,,,,,,,,,,,,,,No,False,"          "
DRKS00020935,"7 April 2025","T. cruzi-induced beta-adrenergic and muscarinic auto-antibodies, and selenium nutritional status in patients with Chagas disease","T. cruzi-induced beta-adrenergic and muscarinic auto-antibodies, and selenium nutritional status in patients with Chagas disease - AUTOS-CHAGAS                                                                                                                                                                                                                                                                                                                                                                                                                                                                                                                                                                                                                                                                                                                                                                                                                                                                                                                                                                 ",,"Charité Campus Charité Mitte",27/02/2020,"  20200227","10/13/2025 15:56:09","German Clinical Trials Register",http://drks.de/search/en/trial/DRKS00020935,"Not Recruiting",No,"18 Years","65 Years",All,15/06/2023,300,observational,"Allocation: ; Masking: ; Control: ; Assignment: ; Study design purpose: diagnostic ",,Bolivia,Thomas,Zoller,"Charitéplatz 1",info@chagas.info,"+49 30 450 553122","Fächerverbund Infektiologie, Pneumologie und Intensivmedizin, Charité - Universitätsmedizin Berlin","Inclusion criteria: • Positive serology for infection with T. cruzi according to WHO standard (except for healthy controls)<br>• Written informed consent according to ICH-GCP standard procedures<br>• Minimum age 18 years<br>• Maximum age 65 years<br>• Patient meets criteria for at least one of the five clinical categories (IND, CAD, GID, CGD, HEC)*","Exclusion criteria: • Known active or chronic infections other than T. cruzi infection<br>• Known HIV-infection<br>• History of, or current autoimmune disease<br>• Medical history of any cardiac or gastrointestinal disease unrelated to Chagas disease<br>• Immunosuppression by medication or other diseases<br>• Intake of micronutrient supplementation<br>• Diabetes mellitus"," <br>B57;Chagas disease","Group 1: Patients with evidence of infection with T. cruzi.<br>After obtaining informed consent, patients will be asked to donate 20ml of additional blood in the context of a clinically indicated venipuncture. Clinical data with relevance to manifestations of chagas disease and available examination results will be reviewed, stored and analysed. The study has only one visit and ends for the patient after the procedures described.","Clinical validation of a new test for autoantibodies in chronic chagas disease","Correlation of autoantibodies with manifestations of chronic chagas disease, selenium status of patients with chronic chagas disease",U1111-1248-6038,"Charité Campus Charité Mitte",,Approved,26/08/2019,"Ethikkommission der Charité – Universitätsmedizin Berlin","Charitéplatz 1 10117 Berlin Germany",(+49)30-450517222,ethikkommission@charite.de,,,http://drks.de/search/en/trial/DRKS00020935#studyResults,http://drks.de/search/en/trial/DRKS00020935#studyProtocols,31/12/2023,,,http://drks.de/search/en/trial/DRKS00020935#basicReporting,http://drks.de/search/en/trial/DRKS00020935#basicReporting,http://drks.de/search/en/trial/DRKS00020935#basicReporting,Yes,"Data will be shared with other researchers on reasonable request.",Yes,False,"          "
RBR-5n4htp,"6 January 2025","New use of a drug named disulfiram for Chagas disease treatment","Disulfiram repurposing in the combined chemotherapy of Chagas disease                                                                                                                                                                                                                                                                                                                                                                                                                                                                                                                                                                                                                                                                                                                                                                                                                                                                                                                                                                                                      ",,"Fundação Oswaldo Cruz",17/02/2020,"  20200217","10/13/2025 15:56:09",REBEC,https://ensaiosclinicos.gov.br/rg/RBR-5n4htp,Recruiting,No,18Y,75Y,-,31/01/2020,,Intervention,"Single-centre, open-label, controlled, non-randomized, clinical trial with 6 parallel arms.",1-2,Brazil,Roberto,Saraiva,"Av Brasil 4365",roberto.saraiva@ini.fiocruz.br,+55(21)3865-9648,"Fundação Oswaldo Cruz","Inclusion criteria: Adults; aged from 18 to 75 years; both sexes; diagnosis of chronic Chagas disease in the indeterminate form or cardiac form at stage A or B1; two distinct serological tests (enzyme-linked immunosorbent assay and indirect immunofluorescence, immunochromatography, or chemiluminescence) positive for Chagas disease ","Exclusion criteria: Previous benznidazol (BZ) or dissulfiram (DF) treatment, contraindications or hypersensitivity; alcoholism; renal or hepatic impairment; gastrointestinal disorders; epileptic, haematological, or psychiatric disorders; pregnancy or lactation; heart disease associated with moderate or severe orovalvar disease, ischemic, congenital or hypertensive heart disease; systemic diseases such as diabetes, autoimmune disorders, cancer, other infectious diseases such as acquired immunodeficiency syndrome; use of any eventual medication within 7 days before starting study treatment, except for dipyrone and paracetamol; use of any antifungal 60 days before starting study treatment; previous intervention studies one year before; cognitive impairments that do not allow the correct understanding of the informed consent; use of any drug toxic to the main body organs within 3 months prior to the start of study treatment; women in childbearing age that refuse to use contraceptive drug; consumption of CYP450 enzyme inducing and/or inhibitory drugs, such as ketoconazole and other known strong CYP3A4 inhibitors, organotoxic or with a long half-life, within 4 weeks prior to the start of the study; consumption of enzyme-inducing and/or inhibitory drugs (P-gp); alcohol consumption in the 48 hours prior to admission to the study and throughout the study period; consumption of foods or drinks containing grapefruit within 7 days prior to admission to the study and throughout the study period","Chagas disease;C01.610","This is a randomized, non-blinded clinical study with six arms. The study aim is to assess a combination of drugs for Chagas disease (CD) therapy, assuming benznidazol (BZ) as the drug of choice plus dissulfiram (DF) as repositioned drug. It is hypothesized that employing the drug of choice with a repositioned one, contributes to the establishment of a new effective, well-tolerated low-cost combination therapy for chronic CD patients. From eligibility confirmation, nine (n = 9) participants will be allocated to the first medication treatment level. The treatment will begin with the lowest dose of BZ for 60 days, corresponding to 100 mg/day associated with 250 mg/day of DF. Upon safety confirmation of the lowest dose of BZ, a new group of 9 patients (group II) will receive a higher dose of BZ (200 mg/day BZ + 250 mg/day DF). After confirming the safety of this dose, another group of 9 patients (group III) will receive the maximum recommended dose of BZ, which is 300 mg/day+250 mg/day DF. Directly after the completion of group III, we will start group IV with 9 others patients receiving the lowest dose of BZ, however associated with 500mg/day of DF. The scheduling scheme will be similar to that previously described for BZ dose progression. Thus, we will have group V (200mg/day of BZ + 500mg/day of DF) and group VI (300mg/day of BZ + 500mg/day of DF). The study will conform to the Oswaldo Cruz Foundation policy on open science effective on the completion of the study. This includes data repository in a public database held by Oswaldo Cruz Foundation.","Occurrence of toxicity (serious adverse events) caused by the combination of BZ and DF detected by clinical observation and blood tests in at least one third of the participants of a same study arm.","Post-treatment negative T. cruzi PCR in more than 80% of the participants of the study arm.",,"Conselho Nacional de Desenvolvimento Científico e Tecnológico - CNPq;Fundação Carlos Chagas Filho de Amparo a Pesquisa do Estado do Rio de Janeiro","Fundação Oswaldo Cruz",Approved,12/12/2019,"Comitê de Ética em Pesquisa ","Avenida Brasil 4365, sala 102 do andar térreo do Pavilhão José Rodrigues da Silva",+55(21)38659585,cep@ini.fiocruz.br,Yes,,,,01/04/2027,,,,,,Yes,"The anonymized dataset supporting the results of the study will be available at the institutional public repository (ARCA Fiocruz) after the publication of the results.",No,False,"          "
NCT04274101,"13 March 2023","Nifurtimox Versus Benznidazole Effectiveness and Tolerance for Chagas Disease Treatment","Nifurtimox Versus Benznidazole Effectiveness and Tolerance for Chagas Disease Treatment, Retrospective Cohort",,"Hospital de Niños R. Gutierrez de Buenos Aires",14/02/2020,"  20200214","10/13/2025 15:56:09",ClinicalTrials.gov,https://clinicaltrials.gov/show/NCT04274101,"Not recruiting",No,N/A,"18 Years",All,01/06/2018,900,Observational,,,Argentina,,,,,,,"<br>    Inclusion Criteria:<br><br>    - Patients between 0 and 18 years of age with confirmed Chagas disease (defined as patients<br>    under 8 months with positive parasitemia or older with 2 positive different techniques for<br>    serology) that received treatment with Nifurtimox or Benznidazole.<br><br>    Exclusion Criteria:<br><br>    - Patients that abandoned follow-up<br>   ",,"Chagas Disease","Other: Clinical Manifestations;Diagnostic Test: Serologic response;Diagnostic Test: Direct method;Behavioral: Adverse events","Nifurtimox versus Benznidazole serologic, parasitemia and clinical response for treatment in patients","Nifurtimox versus Benznidazole security and tolerance;To compare Chagas disease characteristics associated with treatment","Nifurtimox vs. Benznidazole","Please refer to primary and secondary sponsors",,,,,,,,,,,,,,,,,,,,No,False,"          "
