TrialID,"Last Refreshed on","Public title","Scientific title",Acronym,"Primary sponsor","Date registration","Date registration3","Export date","Source Register","web address","Recruitment Status","other records","Inclusion agemin","Inclusion agemax","Inclusion gender","Date enrollement","Target size","Study type","Study design",Phase,Countries,"Contact Firstname","Contact Lastname","Contact Address","Contact Email","Contact Tel","Contact Affiliation","Inclusion Criteria","Exclusion Criteria",Condition,Intervention,"Primary outcome","Secondary outcome","Secondary ID","Source Name","Secondary Sponsor","Ethics Status","Ethics Approval Date","Ethics Contact Name","Ethics Contact Address","Ethics Contact Phone","Ethics Contact Email","results yes no","results date posted","results url link","results url protocol","results date completed","results date first publication","results summary","results baseline char","results adverse events","results outcome measures","results ipd plan","results ipd description","Prospective registration","Bridging flag truefalse","Bridged type"
NCT07033325,"8 September 2025","University-Based Chagas Testing in Salta Province, Argentina","Mass Screening for Chagas Disease Among University Entrants as a Strategy to Improve Access to Diagnosis and Treatment in the Province of Salta, Argentina",,"Mundo Sano Foundation",13/06/2025,"  20250613","10/13/2025 15:56:09",ClinicalTrials.gov,https://clinicaltrials.gov/study/NCT07033325,Recruiting,No,"18 Years",N/A,All,11/09/2024,5000,Observational,,,Argentina," ; ","Adriana Echazu, PhD;Ruben O Cimino, PhD",,;,;,"Mundo Sano Foundation;Instituto de Investigaciones de Enfermedades Tropicales, Univeridad Nacional de Salta","Inclusion criteria:<br><br> - Member of the university community (e.g., student, faculty, administrative staff, or<br>   other personnel).<br><br> - Aged 18 years or older.<br><br> - Of any sex or gender.<br><br> - Able and willing to provide informed consent.<br><br>Exclusion Criteria:<br><br>- Prior confirmed diagnosis of Trypanosoma cruzi infection.",,"Chagas Disease;Trypanosoma Cruzi Infection;Chronic Chagas Disease","Diagnostic Test: Rapid diagnostic test (RDT) for Trypanosoma cruzi infection.","Prevalence of Trypanosoma cruzi infection.;Distribution of Trypanosoma cruzi infection.;Field verification of the RDT","Acceptability of the RDT-based testing strategy in a non-health setting;Feasibility of implementing RDT-based testing in a non-health setting;Treatment outcomes among participants with confirmed Trypanosoma cruzi infection",5/2024-SCRTI-UNSa,"Please refer to primary and secondary sponsors","Universidad Nacional de Salta",,,,,,,,,,,,,,,,,,,No,False,"          "
RBR-3dcrj98,"24 June 2025","Open prospective study evaluating TIMP (Tissue Inhibitor of Matrix Metalloproteinase) as a biomarker of Myocardial Fibrosis in patients diagnosed with Chagas Disease","Prospective, open cohort study to evaluate TIMP as a biomarker of Myocardial Fibrosis in Chagas Disease                                                                                                                                                                                                                                                                                                                                                                                                                                                                                                                                                                                                                                                                                                                                                                                                                                                                                                                                                                                    ",,"Pronto Socorro Cardiológico de Pernambuco Prof. Luiz Tavares - PROCAPE",05/06/2025,"  20250605","10/13/2025 15:56:09",REBEC,https://ensaiosclinicos.gov.br/rg/RBR-3dcrj98,Recruiting,No,18Y,80Y,-,01/04/2024,,Observational,,,Brazil,Silvia,Martins,"Rua dos Palmares, s/n, Santo Amaro",s.m.martins@uol.com.br,+55(81)31817211,"Pronto Socorro Cardiológico de Pernambuco Prof. Luiz Tavares - PROCAPE","Inclusion criteria: Participants diagnosed with Chagas cardiomyopathy, with reactive serology by two different serological methods (indirect immunofluorescence, indirect hemagglutination, complement fixation, conventional ELISA and recombinant ELISA immunoassay), with and without left ventricular dysfunction, as determined by transthoracic echocardiography; age 18 years or older up to 80 years or younger; both sexes; provision of written, signed and dated Informed Consent Form","Exclusion criteria: Individuals with Trypanosoma cruzi infection in the absence of clinical manifestations and signs of cardiac involvement as characterized by normal electrocardiogram, chest X-ray, and echocardiogram; history or current diagnosis of malignant neoplasia; chronic use of corticosteroids, anti-inflammatory drugs, or immunosuppressants; patients with pacemakers, implantable cardioverter-defibrillators (ICDs), cardiac resynchronization devices, metal clips for aneurysms, or other metallic implants that may contraindicate MRI; individuals with known coronary artery disease (CAD) (acute myocardial infarction, unstable angina, history of myocardial revascularization or angioplasty, and documented coronary obstruction by catheterization or coronary CT angiography); research participants who have participated in clinical trial protocols within the last 12 months, unless the investigator determines potential direct benefit (per CNS Resolution 251, August 7, 1997, Section III, Subitem J); alcohol and substance abuse (prior diagnosis according to DSM-V criteria); illicit drug use; any clinical condition that the investigating physician interprets as a risk to participant inclusion; claustrophobic participants unwilling to take the study-prescribed anxiolytic (Rivotril 0.25 mg); patients with tachyarrhythmia if decompensated at MRI time; pregnant or lactating women",Trypanosomiasis;C01.610.752.300.900.200.190,"This is an observational study. A group of 210 patients with Chagas Cardiomyopathy, 70 with ventricular dysfunction and 140 without ventricular dysfunction, with the objective of verifying whether there is a correlation between TIMP-1 and the evolution of Chronic Chagas Cardiomyopathy so that TIMP-1 can be used as a biomarker in the future. Patients will be monitored for a period of 18 months, from April 2024 (when the first participant was included) to January 2027 (when the last participant included ends the follow-up), with medical consultations and clinical, imaging and laboratory exams, distributed in visits that will occur throughout the follow-up period.","Statistical correlation between TIMP-1 and clinical progression in Chronic Chagasic Cardiomyopathy over 18 months of trial follow-up, analyzed with parametric tests for Gaussian-distributed samples or non-parametric tests for non-normal distributions.","Evaluate plasma TIMP-1 levels in participants diagnosed with Chagas cardiomyopathy with and without ventricular dysfunction over an 18-month follow-up period;Determine the correlation between plasma TIMP-1 levels and left ventricular systolic function, assessed by transthoracic echocardiography and cardiac magnetic resonance imaging (MRI), at baseline and after 18 months of follow-up;Determine the correlation between plasma TIMP-1 and NT-proBNP levels at baseline and after 18 months;Determine the correlation between plasma TIMP-1 levels and global longitudinal strain (GLS) at baseline and at 18-month follow-up;Correlate global longitudinal strain (GLS) with myocardial fibrosis (assessed by cardiac MRI) and ejection fraction (assessed by transthoracic echocardiography) throughout the 18-month period;Collect and store participant blood samples to establish a biorepository for future development of a prognostic test for Chagas disease;Perform metabolomic analysis of participant blood samples;Evaluate the immune/inflammatory response in Chagas disease",,"Financiadora de Estudos e Projetos - FINEP","Pronto Socorro Cardiológico de Pernambuco Prof. Luiz Tavares - PROCAPE",Approved,19/05/2025,"Comitê de Ética em Pesquisa ","Rua Marques de Amorim, nº 310. Hospital Universitário Osvaldo Cruz, Pavilhão Ovídio Montenegro (POM)",+55(81)31841271,cep_huoc.procape@upe.br,Yes,,,,09/11/2026,,,,,,Yes,"The dissemination strategy for this study includes targeted outreach to civil society, the scientific community, healthcare professionals, and SUS (Brazilian Unified Health System) policy makers. Science communication activities will be conducted in schools through partnerships with state education departments, and may include developing oral health educational materials. Research findings will be disseminated through policy briefs for health administrators, as well as through scientific societies and specialized media outlets.",No,False,"          "
JPRN-jRCTs031250123,"15 August 2025","Specific Clinical Study of Benznidazole and Nifurtimox for Chagas Disease","A multicenter clinical study to evaluate the efficacy and safety of monotherapy with benznidazole or nifurtimox in patients with Chagas disease, or switching from monotherapy with benznidazole to monotherapy with nifurtimox                                                                                                                                                                                                                                                                                                                                                                                                                                                                                                                                                                                                                                                                                                                                                                                                                                                                                                                         ",,"Yamaoto Kei",23/05/2025,"  20250523","10/13/2025 15:56:09",JPRN,https://jrct.mhlw.go.jp/latest-detail/jRCTs031250123,"Not Recruiting",No,"Not applicable","Not applicable",Both,01/07/2025,45,Interventional,"single arm study, open(masking not used), uncontrolled control, single assignment, treatment purpose",2-3,,Kei,Yamamoto,"1-21-1 Toyama Shinjyuku-ku Tokyo",yamamoto.k@jihs.go.jp,+81-332017181,"Japan Institute for Health Security National Center for Global Health and Medicine","Inclusion criteria: 1. Patients who have been confirmed to have Chagas disease using one of the following methods, regardless of gender, nationality or race. <br><1>The protozoa were detected by optical microscopy of blood smears (thin or thick layer) or tissue samples. <br><2> The results of nucleic acid amplification tests such as PCR using blood or other tissue samples were positive. <br>(3) Screening was carried out using enzyme-linked immunosorbent assay (ELISA) or immunochromatography, and the results of radioimmunoprecipitation assay (RIPA) or other antibody tests were positive. <br>(This does not include the results of screening tests using immunochromatography carried out by organizations other than the organization in charge of the test) <br>2. The subject weighed at least 2.5 kg at the time of acquisition. <br>3. Patients who can provide written consent for participation in the research, depending on the patient's age, etc.","Exclusion criteria: 1. Patients who are hypersensitive to the drug in question <br>2. Pregnant, lactating, or possibly pregnant patients, or patients who do not consent to discontinuing breast-feeding during the study period <br>3. Patients who are diagnosed with alcohol dependence and are receiving treatment at the time of obtaining consent <br>4. Patients who do not consent to abstaining from alcohol during the period of taking the drug and for three days after finishing taking it <br>5. Patients with severe hepatic insufficiency <br>6. Patients with severe renal failure (serum creatinine of 3 mg/dL or more on a constant basis, or dialysis) <br>7. Patients who have taken disulfiram within 2 weeks of starting the medication <br>8. Patients with chronic cardiomyopathy (NYHA classification III or higher) with confirmed dilated cardiomyopathy <br>9. Patients with severe gastrointestinal damage (severe megacolon, severe megaesophagus) <br>10. Patients who are unable to agree to contraception during the period of administration of benznidazole and for 5 days after the end of administration <br>11. Patients who are unable to agree to contraception during the period of administration of nifurtimox and for 3 months after the end of administration in the case of male patients, and for 6 months after the end of administration in the case of female patients. If the patient is unable to agree to the contraception period for nifurtimox, nifurtimox will not be administered and the patient will be considered to have withdrawn from the study. <br>12. Patients who the principal investigator or subinvestigator judges to be inappropriate for participation in this study",Chagas,"Treatment with un-licensed medicine","1) If the blood PCR test is positive before treatment begins: the PCR test is negative one year after treatment begins <br>2) If the blood PCR test is negative before treatment begins: the antibody titer decreases (by more than twofold) or becomes negative two years after treatment begins","1) Rate of decline in serum antibodies <br>2) Presence or absence of cardiac or intestinal complications 2 years after the start of treatment <br>3) Presence or absence of adverse events and adverse events leading to discontinuation of treatment <br>4) Concordance between screening and confirmatory tests (antibody tests)",,,"Ohmagari Norio",Approval,28/03/2025,kenkyu-shinsa@jihs.go.jp,kenkyu-shinsa@jihs.go.jp,+81-3-3202-7181,kenkyu-shinsa@jihs.go.jp,,,,,,,,,,,,,Yes,False,"          "
NCT06632600,"8 September 2025","A Study of Efficacy, Safety, Tolerability of LXE408 in Participants With Chronic Chagas Disease.","A Randomized, Participant- and Investigator-blinded, Controlled, Parallel Group Study to Assess the Efficacy, Safety, Tolerability, Pharmacokinetics and Pharmacodynamics of LXE408 in Participants With Chronic Chagas Disease Without Severe Organ Dysfunction.",,"Novartis Pharmaceuticals",07/10/2024,"  20241007","10/13/2025 15:56:09",ClinicalTrials.gov,https://clinicaltrials.gov/study/NCT06632600,Recruiting,No,"18 Years","60 Years",All,28/04/2025,130,Interventional,"Allocation: Randomized. Intervention model: Parallel Assignment. Primary purpose: Treatment. Masking: Quadruple (Participant, Care Provider, Investigator, Outcomes Assessor). ","Phase 2","United States;Argentina;Brazil;Colombia;Argentina;Brazil;Colombia;United States"," ; ","Novartis Pharmaceuticals;Sergio Romero",,novartis.email@novartis.com;sergio.romero@bmc.org,1-888-669-6682;,,"Inclusion Criteria:<br><br> - Male or female participants aged = 18 years to = 60 years old<br><br> - Confirmed diagnosis of T. cruzi infection<br><br> - History that participant has been determined to be in chronic phase of CD<br><br> - Written informed consent must be obtained before any assessment is performed, and<br>   participants should express understanding of the consent form and the study<br><br> - Participants must be considered by the investigator eligible for and able to comply<br>   with local prescribing information for benznidazole<br><br> - Ability and willingness to communicate well with the investigator/study site and<br>   comply with requirements of the study<br><br>Exclusion Criteria:<br><br> - Signs (on physical examination) and/or symptoms of CD in the acute phase as<br>   determined by the investigator at screening<br><br> - History of CD treatment with benznidazole or nifurtimox at any time in the past<br><br> - History of and/or current (at screening) symptoms or signs (physical examination<br>   findings) of moderate or severe CD-related gastrointestinal disease<br><br> - Participants who weigh < 50 kg or >90kg at screening<br><br> - At sites conducting the MRI assessments, participants may participate in the overall<br>   study, but will be excluded from the MRI assessment if they have contraindications<br>   to MRI imaging<br><br> - Any clinically significant disease during screening that, in the opinion of the<br>   investigator, would put the safety of the participant at risk through participating,<br>   or which would affect the efficacy or safety analysis if the disease/condition<br>   exacerbated during the study, or would compromise participant compliance or preclude<br>   completion of the study<br><br> - Documented history or current findings at screening of clinically significant<br>   cardiovascular conditions such as, but not limited to: unstable ischemic heart<br>   disease; NYHA Class III/IV heart failure (due to Chagas disease or other<br>   conditions); arrhythmias<br><br> - Known or suspected ongoing, chronic or recurrent viral, bacterial or fungal<br>   infectious diseases including but not limited to: Tuberculosis, leishmaniasis,<br>   severe malaria, atypical mycobacterial infection, listeriosis, aspergillosis, or<br>   endemic mycoses, and/or documented positivity for human immunodeficiency virus (HIV)<br>   infection<br><br> - History of lymphoproliferative disease or any known malignancy or history of<br>   malignancy of any organ system within the past 5 years prior to screening (except<br>   for basal cell carcinoma or actinic keratosis that have been treated with no<br>   evidence of recurrence in the past 3 months, carcinoma in situ of the cervix or<br>   non-invasive malignant colon polyps that have been removed)<br><br> - Any surgical or medical condition which might significantly alter the absorption,<br>   distribution, metabolism, or excretion of drugs, or which may jeopardize the<br>   participant during the study period<br><br>    - Pancreatic injury or pancreatitis: If any single parameter of amylase or lipase<br>     exceeds 1.5x ULN at screening Participants with known recurrent pancreatitis<br>     (more than 1 episode in lifetime, from any cause) are excluded<br><br>    - Liver disease or liver injury as indicated by abnormal liver function tests<br>     (LFTs):<br><br>Any single parameter of ALT, AST, GGT, alkaline phosphatase must not exceed 1.5x ULN at<br>screening Serum bilirubin must not exceed the ULN at screening elevated serum bilirubin<br>is not excluded if there is a documented history of Gilbert's Syndrome<br><br>• History of renal disease as indicated by creatinine level above 1.5x ULN or<br>microalbuminuria or hematuria at screening; Evidence of urinary obstruction, or<br>difficulty in voiding at screening; evidence of congenital renal abnormalities with known<br>effect on renal function; calculated eGFR <60 mL/min (<0.835 mL/s) using the CKD-EPI<br>formula for adults<br><br> - Participants with screening hematology parameters outside of the thresholds<br><br> - Current use of medications prohibited by the protocol at screening and/or baseline<br>   visits, or expected use of any prohibited medication during the study treatment<br>   period<br><br> - Use of other investigational drugs at the time of study drug dosing<br><br> - History of multiple and recurring allergies or allergy to the investigational<br>   compound/compound class being used in this study or to benznidazole<br><br> - History of drug abuse or unhealthy alcohol use within the 12 months prior to dosing<br><br> - Pregnant or nursing (lactating/breast-feeding) women<br><br> - Women of child-bearing potential, defined as all women physiologically capable of<br>   becoming pregnant, unless they are using highly effective methods of contraception<br>   during dosing and for 5 days after stopping of investigational drug and benznidazole<br><br> - Participants who, in the opinion of the investigator, will not be able to comply<br>   with study procedures or visits, adhere to dosing schedule, or other otherwise be in<br>   compliance with study requirements<br><br>Other protocol-defined inclusion/exclusion criteria may apply.",,"Chagas Disease","Drug: LXE408;Drug: Placebo;Drug: Benznidazole","Presence or absence of sustained parasitological clearance using polymerase chain reaction (PCR) results over 6 months - LXE408 28 days versus placebo.","Presence or absence of sustained parasitological clearance using polymerase chain reaction (PCR) results over 6 months - LXE408 -14 days versus placebo;Presence or absence of sustained parasitological clearance using polymerase chain reaction (PCR) results over 6 months-LXE408 - 28 days and 14 days versus benznidazone;Presence or absence of parasitological clearance;Presence or absence of sustained parasitological clearance over 12 months by PCR testing;Time to parasitological clearance based on serial PCR testing;Presence or absence of seroreversion using conventional serology;Occurrence and severity of treatment emergent adverse events during the study;Occurrence of adverse events resulting in treatment discontinuation;Occurrence of all-cause mortality through end of study visit;Maximum plasma concentration (Cmax) of LXE408;Time to maximum plasma concentration (Tmax) of LXE408;Area under the plasma concentration-time curve from time 0 to 8 hours post-dose (AUC0-8);Pre-dose concentration",CLXE408B12201,"Please refer to primary and secondary sponsors",,,,,,,,,,,,,,,,,,,,Yes,False,"          "
