CTRI/2022/02/040197,"22 July 2024","short course antiseisure medication in children & adolescent (low risk subgroup) with single calcified brain NCC","Early antiseizure medication tapering in children and adolescents aged 2-18 years with single calcified parenchymal neurocysticercosis in a low-risk subgroup identified by risk assessment: a single arm intervention study                                                                                                                                                                                                                                                                                                                                                                                                                                                                                                                                                                                                                                                                                                                                                                                                                                                                                                                          ",,"All India Institute of Medical Science New Delhi",10/02/2022,"  20220210","10/13/2025 16:04:25",CTRI,http://www.ctri.nic.in/Clinicaltrials/pmaindet2.php?trialid=63487,"Not Recruiting",No,,,,01/03/2022,30,Interventional,"Single Arm Study   Method of generating randomization sequence:Not Applicable  Method of allocation concealment:Not Applicable  Blinding and masking:Not Applicable",N/A,India,"Dr Biswaroop Chakrabarty",,"Department of Pediatrics Teaching Block, Third Floor All IndiaInstitute of Medical Sciences, New DelhiNew DelhiDELHI110029India ",biswaroopchakrabarty@gmail.com,9818260603,"AIIMS New Delhi","Inclusion criteria: a)Children and adolescents aged 2-18 years with single parenchymal calcified or granular NCC with follow up from viable NCC stage <br/ ><br>b)Seizure free on ASM for 6-9 months or12-15 months <br/ ><br>C) resolving or calcified NCC @ 6 month CECT <br/ ><br>","Exclusion criteria: h/o status epilepticus requiring hospitalization <br/ ><br>three or more episodes of seizures after starting ASM <br/ ><br>significant perilesional edema ( 2 times the size of calcified focus or any size of perilesional edema with calcified focus >1 cm. <br/ ><br>any other brain pathogy ( hippocampal sclerosis, vascular malmormation, old insult sequale)","Health Condition 1: B699- Cysticercosis, unspecified","Intervention1: 1.identify a low-risk group by risk assessment based on clinical, EEG, and MRI brain parameters which has low probability of seizure recurrence<br>2.early tapering of ASM in the low-risk group: a low-risk group ( in subject with single calcified NCC and seizure free on ASM for at least 12 months) will be identify by risk assessment based on clinical, EEG, and MRI brain parameters which has low probability of seizure recurrence, and incidence of staying seizure free after early tapering of ASM in the low-risk group.<br><br>Control Intervention1: Not applicable: Not applicable<br>","a)to identify a low-risk group by risk assessment based on clinical, EEG, and MRI brain parameters which has low probability of seizure recurrence, and <br/ ><br>b)to estimate the incidence of staying seizure free after early tapering of ASM in the low-risk group with follow up duration of at least 6 months <br/ ><br>Timepoint: 6 months after stopping ASM","a)to estimate the association of MRI brain parameters with seizure recurrence in the low-risk group after early tapering of ASM with follow up duration of at least 6 months <br/ ><br>b)to estimate the association of clinical, EEG and MRI brain parameters with seizure recurrence in patients not included in the low-risk group and on ASM therapy during the study period <br/ ><br>Timepoint: follow up duration at least 6 months",NIL,"All India Institute of Medical Sciences, Ansari Nagar, New Delhi",,Approved,01/02/2023,"Institute Ethics Committee for Post Graduate Research, AIIMS, New Delhi",,,,,,,,31/01/2024,,,,,,,,Yes,False,"          "
NCT05010811,"7 September 2021","Two Cases of Pulmonary Cysticercosis Manifesting as Pleural Effusion: Case Report and Literature Review","Two Cases of Pulmonary Cysticercosis Manifesting as Pleural Effusion: Case Report and Literature Review",,"Second Affiliated Hospital, School of Medicine, Zhejiang University",11/07/2021,"  20210711","10/13/2025 16:04:25",ClinicalTrials.gov,https://clinicaltrials.gov/show/NCT05010811,"Not recruiting",No,"45 Years","67 Years",All,22/10/2016,2,Observational,,,," ","Pingli Wang, MD",,,,"the same research center","<br>    Inclusion Criteria:<br><br>     1. Clinical diagnosis of Pulmonary Cysticercosis?<br><br>     2. With pleural effusion<br><br>    Exclusion Criteria:<br><br>    1.No cysticercosis was found by biopsy or antibody test<br>   ",,Cysticercosis,,"Amount of pleural effusion;Rate of Eosinophil ratio;Changes of lesions under chest radiography or CT",,2016-122,"Please refer to primary and secondary sponsors",,,,,,,,,,,,,,,,,,,,No,False,"          "
CTRI/2020/04/024815,"24 November 2021","To evaluate reduction in number of lesions in disseminated cysticercosis after 2 weeks of albendazole with whole body MRI -A Pilot Study ","Lesion reduction on whole body MRI in disseminated cysticercosis after 2 weeks of albendazole -A Pilot Study                                                                                                                                                                                                                                                                                                                                                                                                                                                                                                                                                                                                                                                                                                                                                                                                                                                                                                                                                                                 ",,"Kinzang Wangda",23/04/2020,"  20200423","10/13/2025 16:04:25",CTRI,http://www.ctri.nic.in/Clinicaltrials/pmaindet2.php?trialid=42479,"Not Recruiting",No,,,,01/05/2020,40,Interventional,"Single Arm Trial<br>  Method of generating randomization sequence:Not Applicable  Method of allocation concealment:Not Applicable  Blinding and masking:Not Applicable",N/A,India,"Dr Neeraj Kumar",,"Department Of Neurology, King Georges Medical University,Shah Mina Road, Chowk, Lucknow, Uttar Pradesh, India ",drneeraj2903@gmail.com,9450357392,"King Georges Medical University","Inclusion criteria: Inclusion criteria: <br/ ><br>All the cases of disseminated cyscticercosis. <br/ ><br> <br/ ><br>Patients of neurocysticercosis will be diagnosed on the basis of Del Brutto criteria. <br/ ><br> <br/ ><br>Disseminated cysticercosis will be diagnosed as presence of multiple, (three or more than three) cystic viable lesions in the brain along with involvement of an additional extra site. <br/ ><br>","Exclusion criteria: Patient in cysticercal encephalitis. <br/ ><br>The patients having evidence of systemic illness such as primary malignancy,HIV,Hepatitis B and C virus, pulmonary and systemic tuberculosis. <br/ ><br>Patients/ attendants refusing consent. <br/ ><br>","Health Condition 1: G998- Other specified disorders of nervous system in diseases classified elsewhereHealth Condition 2: B608- Other specified protozoal diseases","Intervention1: Albendazole Therapy: Albendazole 15mg/kg in two divided doses daily for 14 days. Three days prior to albendazole, patients will be primed with oral methylprednisolone(0.75-1mg/kg) and will be continued in full dose during the course of therapy followed by tappering in next 2-3 weeks(0.25mg/kg/week). Oxcarbazepine 10-15mg/kg as first line antiepileptic drug and levetiracetam/lacosamide, if seizure is not controlled.<br><br>Control Intervention1: NOT APPLICABLE: NOT APPLICABLE<br>","To evaluate reduction in number of cysticercus lesions after 2 weeks of albendazole.Timepoint: Three months","To evaluate for symptomatic improvement after the therapy.Timepoint: patients will be followed up on monthly basis.",NIL,"King Georges Medical University,Shah Mina Road, Chowk, Lucknow, Uttar Pradesh, IndiaPin code. 226003","Dr Neeraj Kumar",Approved,14/02/2020,"King Georges Medical University UP.,Institutional Ethics Comittee",,,,,,,,,,,,,,,,Yes,False,"          "
CTRI/2020/03/023792,"24 November 2021","Comparison of a specific drug for two different time durations for treatment of Neurocysticercosis in children","Fourteen days versus twenty eight days course of Albendazole therapy for Neurocysticercosis in children: An open labelled, two arm, randomized controlled trial                                                                                                                                                                                                                                                                                                                                                                                                                                                                                                                                                                                                                                                                                                                                                                                                                                                                                                                                                         ",,"Narain Das Vaswani",05/03/2020,"  20200305","10/13/2025 16:04:25",CTRI,http://www.ctri.nic.in/Clinicaltrials/pmaindet2.php?trialid=40801,"Not Recruiting",No,,,,09/03/2020,60,Interventional,"Randomized, Parallel Group Trial<br>  Method of generating randomization sequence:Computer generated randomization  Method of allocation concealment:Sequentially numbered, sealed, opaque envelopes  Blinding and masking:Open Label","Phase 4",India,"Ankit Singla",,"Office of Head of Department of Paediatrics, Ward-14, Pt. B.D. Sharma Post Graduate Institute of Medical Sciences, Rohtak ",ndvaswani@hotmail.com,9034428284,"Pt. B.D. Sharma PGIMS Rohtak","Inclusion criteria: Children aged 1-14 years newly diagnosed with active neurocysticercosis will be enrolled.","Exclusion criteria: 1. Children who have received albendazole or diagnosed with NCC in preceding 3 months. <br/ ><br>2. Children with intellectual disability or global developmental delay, coexisting neurodegenerative/neurometabolic or any other structural pathology. <br/ ><br>3. Children with recognized progressive neurological illness.  <br/ ><br>4. Children with renal, pulmonary, cardiac or hepatic dysfunction. <br/ ><br>","Health Condition 1: B690- Cysticercosis of central nervous system","Intervention1: Fourteen days Albendazole therapy: Albendazole (15 mg/kg/day) for 14 days plus standard treatment, maximum daily dose being 800 mg.<br>Control Intervention1: Twenty eight days Albendazole therapy: Albendazole (15 mg/kg/day) for 28 days plus standard treatment, maximum daily dose being 800 mg.<br>","Proportion of children with resolution of active lesion (Active lesion was considered to be resolved when either there was complete disappearance of lesion or when T2 hyperintensity within the core of the lesion has become either isointense or hypointense with or without blooming effect on GRE image) at 6 month follow up scan.Timepoint: 6 months","Duration to seizure recurrenceTimepoint: One week to six months",NIL,"Pt. B.D. Sharma Post Graduate Institute of Medical Sciences, Rohtak, Haryana-124001",,Approved,30/12/2019,"Biomedical Research Ethics Committee, Pt. B.D. Sharma Post Graduate Institute of Medical Sciences, Rohtak",,,,,,,,,,,,,,,,Yes,False,"          "
CTRI/2020/02/023575,"24 November 2021","Evaluation of a new MRI sequence in patients with cysticercus infection in brain","Prognostication of neuro-cysticercosis by Multidimensional Diffusion MRI                                                                                                                                                                                                                                                                                                                                                                                                                                                                                                                                                                                                                                                                                                                                                                                                                                                                                                                                                                                                    ",,"CARING MAHAJAN IMAGING",25/02/2020,"  20200225","10/13/2025 16:04:25",CTRI,http://www.ctri.nic.in/Clinicaltrials/pmaindet2.php?trialid=40468,"Not Recruiting",No,,,,01/03/2020,50,Observational,"Single Arm Trial<br>  Method of generating randomization sequence:Not Applicable  Method of allocation concealment:Not Applicable  Blinding and masking:Not Applicable","Phase 1",India,"Vasantha Kumar Venugopal",,"IMAGING DIVISION, CARING & MAHAJAN IMAGING E19 DEFENCE COLONY",vasanthdrv@gmail.com,09718069230,"CARING- Centre for Advanced Research in Imaging, Neuroscience and Genomics","Inclusion criteria: Fifty patients with a fresh diagnosis of neurocysticercosis will be enrolled in this study. The patients will undergo a routine standard of care of MRI followed by MD-dMR. Follow up scans will be performed at 6 months and 12 months interval in these patients. The differences in the findings on MD-dMR between lesions developing calcifications and those healing by gliosis will be analyzed.","Exclusion criteria: ","Health Condition 1: B690- Cysticercosis of central nervous system",,"The study will contribute to development of a prognosis predictor model by using multidimensional diffusion weighted sequences.Timepoint: 2 years","The differences in the findings on MD-dMR between patients developing calcifications and those not developing calcifications will be analysed for statistical significanceTimepoint: 2 years",NIL,"Mahajan Imaging, E19 Defence colony, New Delhi- 19",,Approved,04/10/2019,"Mahajan Imaging Ethics Committee",,,,,,,,,,,,,,,,Yes,False,"          "
ISRCTN11630542,"7 December 2020","Role of albendazole in disseminated cysticercosis","Assessment of clinico-radiological outcome in disseminated cysticercosis after albendazole therapy - a prospective evaluation                                                                                                                                                                                                                                                                                                                                                                                                                                                                                                                                                                                                                                                                                                                                                                                                                                                                                                                                                                          ",,"King George's Medical University",28/09/2019,"  20190928","10/13/2025 16:04:25",ISRCTN,http://isrctn.com/ISRCTN11630542,"Not Recruiting",No,,,Both,05/12/2015,29,Interventional,"Single-centre open-label prospective design (Treatment)","Not Applicable",India,,,,,,,"Inclusion criteria: All consecutive patients diagnosed with disseminated cysticercosis were included in the study. A diagnosis of cysticercosis was made on the basis of the established diagnostic criteria. Disseminated cysticercosis was defined as the presence of multiple (= 3) cystic viable lesions in the brain, along with evidence of involvement of at least one extra site, like subcutaneous tissues, skeletal muscles, eyes, or presence in any visceral organ.","Exclusion criteria: <br>        1. Patients with disseminated cysticercosis having features suggestive of cysticercal encephalitis. Cysticercal encephalitis was diagnosed if the patient had signs of raised intracranial pressure, like papilledema, severe headache, altered sensorium, heavy first-contact lesion load, and generalized cerebral edema<br>        2. Patients with malignancy, tuberculosis, hepatitis B or hepatitis C virus positivity, human immunodeficiency virus infection, hepatic involvement, focus of any pyogenic infection, and pregnancy<br>        3. Patients with a known hypersensitivity to albendazole in childhood, or those who had been administered albendazole, with or without corticosteroids, in the past 6 months<br>      ","Disseminated neurocysticercosis <br>Infections and Infestations <br>Cysticercosis of central nervous system","<br>        Antiepileptic drugs were prescribed to all the patients. Oxcarbazepine at a dose of 10-15 mg/kg/day was used as the first-line antiepileptic drug. If the control over seizures was neither obtained nor oxcarbazepine tolerated, levetiracetam was the next drug prescribed. To aid prompt control of seizures, clobazam was added for the initial 2-3 weeks; it was deemed that appropriate therapeutic levels of oxcarbazepine would have been achieved by this time. The patients were administered albendazole after excluding those with cysticercal encephalitis. In patients with vitreoretinal cysticercosis or cysticercal lesions abutting optic nerve, albendazole was initiated at least 6 weeks after the surgical excision of the cyst. Albendazole was given at a dose of 15 mg/kg/day (given in 2 divided doses). Three days prior to starting albendazole, the patients were primed with oral methylprednisolone (0.75-1 mg/kg of body weight) and it was continued in full dose during the course of albendazole therapy (28 days), followed by tapering in next 2-3 weeks (0.25 mg/kg /week). A total of 3 cycles of albendazole were administered; each cycle was of 28 days and the difference of 3 months between the two evaluations was calculated from the last tapered dose of oral methylprednisolone. The protocol warranted discontinuation of albendazole if any patient developed a rash or an untoward complication like raised intracranial pressure, signs of meningeal irritation, visual disturbances or suggestion of myelitis; oral methylprednisolone, however, was to be continued to manage the complications arising from the release of antigens. In severe cases, intravenous dexamethasone (0.1 mg/kg of body weight, maximum 30 mg/day), in three to four divided doses for the initial 2 weeks was plan","<br>        Assessed thrice after enrolment at a difference of 3 months, each calculated from the completion of an individual cycle:<br>        1. Frequency of seizures noted as individual events as reported by the patient or the observer<br>        2. Intracranial lesion load in patients with >20 lesions and those with =20 lesions measured using MRI of the brain with GAD-contrast<br>      ","Other clinical parameters (palpable/visible subcutaneous lesions), and laboratory assessment (hemogram, liver function tests, kidney function tests, blood sugar) assessed thrice after enrolment at a difference of 3 months, calculated from the end of an individual regime","Nil known;Nil known;76 ECM II-B-Thesis/P19","King George's Medical University",,,01/01/1900,,"Approved 04/12/2015, Institutional Ethics Committee of King George’s Medical University U.P. (Institutional Ethics Committee, Office of the Research Cell, King George’s Medical University, U.P., Lucknow, 226003, India; Tel: +91 (0)9335901790; Email - res@kgmcindia.edu), letter number 7976/Ethics/R.Cell-15, Ref. Code: 76th ECM II-B-Thesis/P19",,,Yes,,,,31/12/2017,,"2020 results in https://pubmed.ncbi.nlm.nih.gov/32171260/ (added 23/11/2020)",,,,"Available on request","    The researchers intend to publish their data in a journal that is most appropriate for tropical locations and involves neuroinfections. They also wish to involve Government functionaries to spread awareness regarding the same to prevent inadvertent or unsupervised administration of albendazole.    IPD sharing statement    The datasets generated during and/or analysed during the current study are/will be available upon request from Dr Hardeep Singh Malhotra (hsmalhotra@kgmcindia.edu).",No,False,"          "
NCT03851419,"11 December 2023","The Burden of (Neuro)Cysticercosis Among People Living With HIV in Rural Tanzania","The Burden of (Neuro)Cysticercosis Among People Living With HIV Compared With HIV-negative Individuals in the Rural Southern Highlands in Tanzania",CYSTINET_Tz,"Technical University of Munich",04/02/2019,"  20190204","10/13/2025 16:04:25",ClinicalTrials.gov,https://clinicaltrials.gov/ct2/show/NCT03851419,"Not recruiting",No,"14 Years",N/A,All,01/04/2018,2584,Observational,,,Tanzania," ","Bernard J Ngowi, MD, PhD",,,,"National Institute for Medical Research","<br>    Inclusion Criteria:<br><br>     - Patients who consent to participate in the study and testing.<br><br>     - Patients of age 14 years and above<br><br>     - Patient living inside the study catchment area<br><br>     - HIV-positive patients<br><br>     - Patient suspected of taeniasis or cysticercosis/neurocysticercosis<br><br>    Exclusion Criteria:<br><br>     - Patients with opportunistic infections.<br><br>     - Study participants taking anthelminthic drugs PZQ and ALB or have received them within<br>       the previous 12 months.<br><br>     - Pregnant women<br><br>     - Patients that are seriously ill.<br><br>     - Patients with epilepsy and other mental disorders that impair thoughts and emotions<br>       such as psychosis.<br>   ",,Neurocysticercosis;HIV/AIDS,"Diagnostic Test: Diagnosis of (Neuro)cysticercosis","Prevalence of cysticercosis;Prevalence of neurocysticercosis","Th1 cytokines among neurocysticercosis patients","CYSTINET-Africa Tz II","Please refer to primary and secondary sponsors","National Institute for Medical Research, Tanzania;Kilimanjaro Clinical Research Institute;Muhimbili University of Health and Allied Sciences",,,,,,,,,,,,,,,,,,,No,False,"          "
NCT03808597,"12 December 2020","Digital Health Promotion in Iringa, Tanzania","Free Digital Health Education for Diseases of Public Health Importance (HIV, Tuberculosis and Taenia Solium Cysticercosis/Taeniosis) in Iringa, Tanzania",,"University of Oslo",02/01/2019,"  20190102","10/13/2025 16:04:25",ClinicalTrials.gov,https://clinicaltrials.gov/show/NCT03808597,"Not recruiting",No,"15 Years","70 Years",All,01/04/2019,600,Interventional,"Allocation: Non-Randomized. Intervention model: Parallel Assignment. Primary purpose: Prevention. Masking: Single (Outcomes Assessor). ",N/A,Tanzania," ","Andrea S Winkler, M, PhdD",,,,"University of Oslo","<br>    Inclusion Criteria:<br><br>     - Living in the selected household (15-70 years), at least for the past six months, and<br>       at least planning to not move the next 12 months.<br><br>     - Must be capable and willing to sign written informed consent and thumb-print for<br>       illiterate participants<br><br>    Exclusion Criteria:<br><br>     - Planning to be out of the village for more than 6 weeks in the next 12 months<br><br>     - Those above 71 or under 15<br><br>     - Not capable of signing consent letter (very sick)<br>   ",,"HIV Infections;Tuberculosis;Cysticercosis;Tapeworm Pork","Other: Digital health promotion intervention","Baseline Health knowledge score;Change from Baseline Health knowledge score, immediately after exposure;Change from Baseline Health knowledge score at 3 months;Change from Baseline Health knowledge score at 6 months;Change from Baseline Health knowledge score at 12 months","Participants own perspectives on the intervention (qualitative)",DigI,"Please refer to primary and secondary sponsors","National Institute for Medical Research, Tanzania;Sokoine University of Agriculture;Technische Universität München",,,,,,,,,,,,,,,,,Yes,,Yes,False,"          "
