TrialID,"Last Refreshed on","Public title","Scientific title",Acronym,"Primary sponsor","Date registration","Date registration3","Export date","Source Register","web address","Recruitment Status","other records","Inclusion agemin","Inclusion agemax","Inclusion gender","Date enrollement","Target size","Study type","Study design",Phase,Countries,"Contact Firstname","Contact Lastname","Contact Address","Contact Email","Contact Tel","Contact Affiliation","Inclusion Criteria","Exclusion Criteria",Condition,Intervention,"Primary outcome","Secondary outcome","Secondary ID","Source Name","Secondary Sponsor","Ethics Status","Ethics Approval Date","Ethics Contact Name","Ethics Contact Address","Ethics Contact Phone","Ethics Contact Email","results yes no","results date posted","results url link","results url protocol","results date completed","results date first publication","results summary","results baseline char","results adverse events","results outcome measures","results ipd plan","results ipd description","Prospective registration","Bridging flag truefalse","Bridged type"
PER-030-24,"26 May 2025","Oxfendazole vs. Antiparasitic standard treatment in neurocysticercosis.","A double-blind multicenter, randomized controlled trial of single and multiple dose regimens of oxfendazole for mild (one or two lesions) parenchymal brain cysticercosis, with an open comparison group.                                                                                                                                                                                                                                                                                                                                                                                                                                                                                                                                                                                                                                                                                                                                                                                                                                                                                                                                    ",,"UNIVERSIDAD PERUANA CAYETANO HEREDIA",18/03/2025,"  20250318","10/13/2025 16:04:25",REPEC,https://repec.ins.gob.pe/maestro/ajax/exportar-ficha-datos-publico/2112/en/,,No,,,Both,01/01/1900,544,Interventional,"Randomized parallel-arm trial of patients with cerebral parenchymal cysticercosis with only one or two viable or degenerating lesions, to evaluate whether a single-dose regimen of OXF (20 mg/kg) results in non-inferior parasiticidal efficacy (lesion resolution) to the currently used 10-day regimens of albendazole (ABZ) and/or praziquantel (PZQ) (providing an easier and simpler regimen) and also whether a 3-dose course of OXF (20 mg/kg/day) may offer greater parasiticidal efficacy (making it the treatment of choice). The analysis plan is designed to allow direct and concrete demonstration of similar or improved efficacy of the comparator regimens in eliminating NCS parasites in this type of NCC, while minimising the risks of disease progression in patients treated with standard therapy.",2-3,Peru,,,,,,,"Inclusion criteria: <br>          <br>          <br>            Male or female individuals between 18 and 75 years of age, with suspected viable or degenerating intraparenchymal brain cysticercosis on neuroimaging (CT or MRI) and fulfill the diagnostic criteria for solitary cysticercus granuloma (Rajshekhar and Chandy, 1997)<br>          <br>          <br>          <br>            If female of child-bearing potential and men, willing to use an adequate method of contraception*, including implants, injectables, combined oral contraceptives, effective intrauterine devices, sexual abstinence, or vasectomized partner while participating in the study.<br>          <br>          <br>          <br>            Patients with normal laboratory values for hemoglobin, platelet counts, total white blood cells, glucose, creatinine, bilirubin, ALT, and AST.<br>          <br>          <br>          <br>          <br>          <br>          <br>          <br>          <br>          <br>          <br>          <br>          <br>          <br>          <br>          <br>          <br>          <br>          <br>          <br>          <br>          <br>          <br>          <br>          <br>          <br>          <br>          <br>          <br>          <br>          <br>          <br>          <br>          <br>          <br>          <br>            Availability to grant informed consent if you are over 18 years of age.<br>          <br>          <br>        ","Exclusion criteria: <br>         <br>          <br>        <br>          <br>        <br>          <br>        <br>          <br>            Multiple lesion sites or more than two adjacent lesions.<br>          <br>        <br>          <br>            Suspected neurotuberculosis (Rajshekhar’s criteria).<br>          <br>        <br>          <br>            More than two viable brain cysts.<br>          <br>        <br>          <br>            Large brain cysts (> 3cm in diameter).<br>          <br>        <br>          <br>            Subarachnoid neurocysticercosis or intraventricular.<br>          <br>        <br>          <br>            Untreated ocular cysticercosis<br>          <br>        <br>          <br>            Previous therapy with ABZ (does not include patients who received single-dose 400 mg ABZ for intestinal parasites), or PZQ in the past twelve months.<br>          <br>        <br>          <br>            Active pulmonary tuberculosis evidenced by a positive chest X-ray and positive sputum smears.<br>          <br>        <br>          <br>            Systemic disease other than NCC that may affect therapy or short-term prognosis, including but not limited to chronic renal failure, hepatic insufficiency, cardiac failure, and steroid-dependent immune diseases.<br>          <br>        <br>          <br>            Patients in unstable condition or with severe intracranial hypertension (ICH). Definition of severe ICH for this study would be the presence of headaches, nausea, and vomiting, and papilledema at fundoscopic examination.<br>          <br>        <br>          <br>            Pregnancy.<br>          <br>        <br>          <br>            History of hypersensitivity to ABZ or PZQ.<br>          <br>        <br>          <br>            Concurrent treatment with cimetidine, ranitidine, or theophylline.<br>          <br>        <br>          <br>            Chronic alcohol or drug abuse.<br>          <br>        <br>          <br>            Positive to Strongyloides infection.<br>          <br>        <br>          <br>            History of reported allergy to contrast substances used in MRI.<br>          <br>        <br>          <br>        <br>        ","B690 Cysticercosis of central nervous system <br>Cysticercosis of central nervous system;B690","<br>          OXF 20 mg/kg, single dose, orally - <br>        <br>          OXF 20 mg/kg, days 1, 4 y 7, orally <br>        <br>          ABZ (15 mg/kg/day for 10 days) + PZQ (50 mg/kg/day, for 10 days), orally <br>","MRI<br>              NAME OF THE RESULT: Proportion of participants whose lesions completely resolved or persist only as small lesion remnants (<20% of the original lesion size.<br>              PERIOD OF TIME WHERE TE MEASUREMENT WILL BE CONDUCTED AND WHICH WILL ALLOW OBTAINING THE<br>              PRIMARY RESULT: Three months after treatment onset ","Seizure diary, clinical evaluation<br>              NAME OF THE RESULT: The frequency of seizure relapses in individuals whose lesions resolved compared to those who had remaining viable or degenerating lesions on month 3 MRI.<br>              PERIOD OF TIME WHERE TE MEASUREMENT WILL BE CONDUCTED AND WHICH WILL ALLOW OBTAINING THE<br>              PRIMARY RESULT: In the initial 12 months after treatment ;MRI<br>              NAME OF THE RESULT: Proportion of participants whose lesions completely resolved or persist only as small lesion remnants (<20% of the original lesion size.<br>              PERIOD OF TIME WHERE TE MEASUREMENT WILL BE CONDUCTED AND WHICH WILL ALLOW OBTAINING THE<br>              PRIMARY RESULT: Three months after treatment onset ;Clinical chart, adverse events and serious adverse event reports.<br>              NAME OF THE RESULT: Proportion of participants in each group who develop serious or severe adverse events, and the numbers of adverse events per group<br>              PERIOD OF TIME WHERE TE MEASUREMENT WILL BE CONDUCTED AND WHICH WILL ALLOW OBTAINING THE<br>              PRIMARY RESULT: In the initial 12 months after treatment ;MRI<br>              NAME OF THE RESULT: Imaging characteristics on MRI at day 15 post treatment onset that are associated with successful lesion resolution on MRI.<br>              PERIOD OF TIME WHERE TE MEASUREMENT WILL BE CONDUCTED AND WHICH WILL ALLOW OBTAINING THE<br>              PRIMARY RESULT: Month 3 ;MRI (gliosis)<br>CT (calcifications)<br>              NAME OF THE RESULT: Demographic, clinical, radiological, or therapeutic variables associated with focal gliosis or residual calcification.<br>              PERIOD OF TIME WHERE TE MEASUREMENT WILL BE CONDUCTED AND WHICH WILL ALLOW OBTAINING THE<br>              PRIMARY RESULT: Month 6 and month 12 ;Clinical chart, MRI<br>              NAME OF THE RESULT: Demographic, clinical, radiological or therapeutic variables associated with seizure relapses.<br>              PERIOD OF TIME WHERE TE MEASUREMENT WILL BE CONDUCTED AND WHICH WILL ALLOW OBTAINING THE<br>              PRIMARY RESULT: During the initial 12 months after anti-parasitic treatment. ;Quality of life survey in epilepsy<br>QOLIE-31<br>              NAME OF THE RESULT: Factors associated with reduced quality of life before and after anti-parasitic treatment for mild parenchymal NCC<br>              PERIOD OF TIME WHERE TE MEASUREMENT WILL BE CONDUCTED AND WHICH WILL ALLOW OBTAINING THE<br>              PRIMARY RESULT: Before treatment and 12 months after antiparasitic treatment. ","SIDISI 211661","UNIVERSIDAD PERUANA CAYETANO HEREDIA",,Approved,18/04/2024,"Comite Institucional de Etica en Investigacion del Hospital Cayetano Heredia","AVENIDA AV. HONORIO DELGADO 262 URB. INGENIERIA DISTRITO SAN MARTIN DE PORRES PROVINCIA LIMA DEPARTAMENTO LIMA ",None,None,,,,"URL: No disponible ",,,,,,,"Yes        ","Not applicable",Yes,False,"          "
CTRI/2024/09/073349,"16 September 2024","Modifying duration of steroid therapy in worm infestation of brain based on initial size","Baseline cyst size guided increase in duration for steroid therapy in viable parenchymal neurocysticercosis a pilot prospective interventional study - NIL                                                                                                                                                                                                                                                                                                                                                                                                                                                                                                                                                                                                                                                                                                                                                                                                                                                                                                                                                           ",,"All India Institute of Medical Sciences New Delhi",04/09/2024,"  20240904","10/13/2025 16:04:25",CTRI,http://www.ctri.nic.in/Clinicaltrials/pmaindet2.php?trialid=111267,Recruiting,No,,,,14/09/2024,30,Interventional,"Non-randomized, Multiple Arm Trial   Method of generating randomization sequence:Not Applicable  Method of allocation concealment:Not Applicable  Blinding and masking:Not Applicable",N/A,India,"Dr Biswaroop Chakrabarty",,"Department of Pediatrics, Mother and Child block,Eighth floor, All India Institute of Medical Sciences, New DelhiNew DelhiDELHI110029India ",biswaroopchakrabarty@gmail.com,9818260603,"All India Institute of Medical Sciences, New Delhi","Inclusion criteria: 1.Children and adolescents aged 2-18 years <br/ ><br>2.Parenchymal NCC, viable (vesicular/colloidal), up to 5 in number <br/ ><br>3.In multiple lesions with sizes less than as well as more than 0.7 cm, it will be included in the 14 days steroid group and only the more than 0.7 cm cyst outcome will be analysed","Exclusion criteria: 1.Received anticysticidal and steroid therapy in the last 6 months <br/ ><br>2.Need for repeat steroid therapy within 6 months follow up <br/ ><br>3.Raised ICP, cysticercal encephalitis <br/ ><br>4.Extra-parenchymal NCC, intra-ocular NCC <br/ ><br>5.Critically sick children <br/ ><br>Co-existing known chronic illness","Health Condition 1: B690- Cysticercosis of central nervous system","Intervention1: Duration of steroid therapy based on baseline cyst size (long arm): Diagnosis will be confirmed as per standard globally accepted criteria and after applying inclusion and exclusion criteria allocation to respective groups will be made as mentioned below:<br>Group 1 (cyst/s more than or equal to 0.7cm): Albendazole 15 mg/kg/day in two divided doses X 7 days PLUS Dexamethasone 0.6 mg/kg/day in four divided dose X 10 days (started 2 days before Albendazole) followed by 4 days tapering<br><br>Control Intervention1: Duration of steroid therapy based on baseline cyst size(short arm): Group 2 (cyst/s less than 0.7cm): Albendazole 15 mg/kg/day in two divided doses X 7 days PLUS Dexamethasone 0.6 mg/kg/day in four divided dose X 5 days (started 2 days before Albendazole)<br>","In children and adolescents aged 2-18 years with viable parenchymal NCC (up to 5 lesions), in cysts more than or equal to 0.7 cm, receiving Dexamethasone (0.6 mg/kg/day) for 14 days, to estimate the proportion of resolved cysts at 6 months (+ 1 month) on CECT Head post completion of albendazole and steroid therapyTimepoint: 6 months post therapy","In children and adolescents aged 2-18 years with viable parenchymal NCC (up to 5 lesions), in cysts less than 0.7 cm receiving Dexamethasone (0.6 mg/kg/day) for 5 days, to estimate the proportion of resolved cysts at 6 months (+ 1 month) on CECT Head post completion of albendazole and steroid therapy <br/ ><br>To estimate breakthrough seizure rates in both the groups over at least 6 months follow up post completion of albendazole and steroid therapyTimepoint: Follow up after 6 months of therapy",NIL,"All India Institute of Medical Sciences, Ansari Nagar, New Delhi 110029,India",,Approved,23/08/2024,"Institute Ethics Committee for Post Graduate Research, AIIMS, New Delhi",,,,,,,,,,,,,,,,Yes,False,"          "
NCT06565507,"11 November 2024","Oxfendazole in Mild Parenchymal Brain Cysticercosis","A Double-blind Multicenter, Randomized Controlled Trial of Single and Multiple Dose Regimens of Oxfendazole for Mild (One or Two Lesions) Parenchymal Brain Cysticercosis, With an Open Comparison Group",,"Universidad Peruana Cayetano Heredia",12/08/2024,"  20240812","10/13/2025 16:04:25",ClinicalTrials.gov,https://clinicaltrials.gov/ct2/show/NCT06565507,"Not recruiting",No,"12 Years","75 Years",All,15/12/2024,544,Interventional,"Allocation: Randomized. Intervention model: Parallel Assignment. Primary purpose: Treatment. Masking: Double (Participant, Investigator). ","Phase 2/Phase 3",," ; ","Hector H Garcia, MD, PhD;Hector H Garcia, MD, PhD",,;hgarcia@jhsph.edu,";+511 3287360","Universidad Peruana Cayetano Heredia;","Inclusion Criteria:<br><br> 1. Male or female individuals between 12 and 75 years of age, with suspected viable or<br>   degenerating intraparenchymal brain cysticercosis on neuroimaging (CT or MRI) and<br>   fulfill the diagnostic criteria for solitary cysticercus granuloma (Rajshekhar and<br>   Chandy, 1997)<br><br> 2. If female of child-bearing potential and men, willing to use an adequate method of<br>   contraception*, including implants, injectables, combined oral contraceptives,<br>   effective intrauterine devices, sexual abstinence, or vasectomized partner while<br>   participating in the study.<br><br> 3. Patients with normal laboratory values for hemoglobin, platelet counts, total white<br>   blood cells, glucose, creatinine, bilirubin, ALT, and AST.<br><br> 4. Availability to grant informed consent if you are over 18 years of age or assent if<br>   you are a minor between 12 and 17 years of age.<br><br>Exclusion Criteria:<br><br> 1. Multiple lesion sites or more than two adjacent lesions.<br><br> 2. Suspected neurotuberculosis (Rajshekhar's criteria) [66,67]<br><br> 3. More than two viable brain cysts.<br><br> 4. Large brain cysts (> 3cm in diameter)<br><br> 5. Subarachnoid neurocysticercosis or intraventricular<br><br> 6. Untreated ocular cysticercosis<br><br> 7. Previous therapy with ABZ (does not include patients who received single-dose 400 mg<br>   ABZ for intestinal parasites), or PZQ in the past twelve months.<br><br> 8. Active pulmonary tuberculosis evidenced by a positive chest X-ray and positive<br>   sputum smears.<br><br> 9. Systemic disease other than NCC that may affect therapy or short-term prognosis,<br>   including but not limited to chronic renal failure, hepatic insufficiency, cardiac<br>   failure, and steroid-dependent immune diseases.<br><br> 10. Patients in unstable condition or with severe intracranial hypertension (ICH).<br>   Definition of severe ICH for this study would be the presence of headaches, nausea,<br>   and vomiting, and papilledema at fundoscopic examination.<br><br> 11. Pregnancy<br><br> 12. History of hypersensitivity to ABZ or PZQ<br><br> 13. Concurrent treatment with cimetidine, ranitidine, or theophylline.<br><br> 14. Chronic alcohol or drug abuse<br><br> 15. Positive to Strongyloides infection<br><br> 16. History of reported allergy to contrast substances used in MRI.",,"Brain Cysticercosis","Drug: Oxfendazole single dose;Drug: Oxfendazole three doses;Drug: albendazole plus praziquantel regime","Efficacy: completely resolution or persistance only as small lesion remnants.","Clinical effectiveness: Seizure relapses.;Safety: Serious adverse events",211661,"Please refer to primary and secondary sponsors","Oxfendazole Development Group",,,,,,,,,,,,,,,,,,,Yes,False,"          "
CTRI/2022/12/048558,"9 January 2023","Effect of Albendazole and steroids vs steroids alone on whole body MRI in disseminated cysticercosis patients.","Quantitative assessment of cysticercosis on whole body MRI in patients with disseminated cysticercosis treated with albendazole with steroids vs steroids alone and outcome assessment at 3 months a randomized controlled trial                                                                                                                                                                                                                                                                                                                                                                                                                                                                                                                                                                                                                                                                                                                                                                                                                                                                                                                        ",,"KING GEORGE MEDICAL UNIVERSITY,UTTAR PRADESH LUCKNOW",28/12/2022,"  20221228","10/13/2025 16:04:25",CTRI,http://www.ctri.nic.in/Clinicaltrials/pmaindet2.php?trialid=77540,"Not Recruiting",No,,,,05/01/2023,20,Interventional,"Randomized, Parallel Group Trial    Method of generating randomization sequence:Computer generated randomization  Method of allocation concealment:Sequentially numbered, sealed, opaque envelopes  Blinding and masking:Participant and Outcome Assessor Blinded","Phase 3/ Phase 4",India,"Dr Jadhav Padmajeet Ranjeetsinh",,"Department of Neurology, King Georges Medical University, Shahmina Road, Chowk, Lucknow, Uttar Pradesh ",drneeraj2903@gmail.com,919450357392,"Department of Neurology","Inclusion criteria: All the cases of disseminated cysticercosis  <br/ ><br>Disseminated cysticercosis will be diagnosed as >= 3 NCC with involvement of at least one extra site like subcutaneous tissues, skeletal muscles, eyes, or presence in any visceral organ. <br/ ><br>Patients of neurocysticercosis will be diagnosed on the basis of Del Brutto criteria.","Exclusion criteria: 1)Patient in cysticercal encephalitis. <br/ ><br>2)Patient with subretinal cysticercosis. <br/ ><br>3)Patients having evidence of systemic illness as malignancy, Tuberculosis, HIV etc <br/ ><br>4)Patients with hypersensitivity to albendazole <br/ ><br>5)Patients with alcohol /substance abuse <br/ ><br>6)Patients with primary psychiatric disease prior to developing neurocysticercosis <br/ ><br>7)Pregnant females <br/ ><br>8)Patients/ attendants refusing consent","Health Condition 1: B699- Cysticercosis, unspecified","Intervention1: ALBENDAZOLE WITH STEROIDS(ORAL METHYLPREDNISOLONE): ALBENDAZOLE(15mg/kg body weight) ONE CYCLE (14 days) WITH STEROIDS(ORAL METHYLPREDNISOLONE-0.75-1mg/kg body weight to start 3 days before starting albendazole and to continue throughout the cycle of albendazole and tapered off in next 3 weeks-0.25 mg/kg/week) WITH STANDARD OF CARE<br>Control Intervention1: STEROIDS(ORAL METHYLPRESDNISOLONE) ONLY: STEROIDS(ORAL METHYLPREDNISOLONE-0.75-1mg/kg body weight for 2 weeks and tapered off in next 3 weeks-0.25mg/kg/week) WITH STANDARD OF CARE<br>","To asess lesion reduction in patients with Disseminated Cysticercosis on Whole body MRI at 3 months of treatment as per protocolTimepoint: To asess lesion reduction in patients with Disseminated Cysticercosis on Whole body MRI at 3 months of treatment as per protocol","To asess quality of life in patients with Disseminated Cysticercosis at baseline and at 3 months of treatment as per protocolTimepoint: At baseline and at 3 months of treatment",NIL,"KING GEORGE MEDICAL UNIVERSITY,SHAH MINA ROAD,CHOWK,LUCKNOW,UTTAR PRADESH",,Approved,03/11/2022,"King George medical universityâ??a institutional ethics commmittee",,,,,,,,,,,,,,,,Yes,False,"          "
