PER-121-06,"4 September 2023","ANTIPARASITIC THERAPY FOR NEUROCYSTICERCOSIS: PHASE II / III STUDY ON SAFETY AND EFFECTIVENESS AND COMBINED TREATMENT OF PRAZICUANTEL AND ALBENDAZOLE","ANTIPARASITIC THERAPY FOR NEUROCYSTICERCOSIS: PHASE II / III STUDY ON SAFETY AND EFFECTIVENESS AND COMBINED TREATMENT OF PRAZICUANTEL AND ALBENDAZOLE                                                                                                                                                                                                                                                                                                                                                                                                                                                                                                                                                                                                                                                                                                                                                                                                                                                                                                                                                              ",,"INSTITUTO NACIONAL DE ALERGIAS Y ENFERMEDADES INFECCIOSAS DE LOS ESTADOS UNIDOS,",26/01/2007,"  20070126","10/13/2025 16:04:25",REPEC,https://www.ins.gob.pe/ensayosclinicos/rpec/recuperarECPBNuevoEN.asp?numec=121-06,"Not Recruiting",No,0,0,--,01/02/2010,180,Interventional,"<br>			Randomized clinical study. double blind, placebo controlled, phase II / III. Designed to compare the efficacy of 10 days of therapy with ABZ when PZQ is added or not in patients with parenchymal neurocysticercosis; in terms of cystic destruction and decrease in seizures during the follow-up period.<br>			Eligible individuals aged 16 to 65 years, with one more viable intraparenchymal cysts and a history of seizures within the last 6 months, will be randomized into one of the two groups. The first group, (Arm 1) is randomized to receive a 10-day course of ABZ (15 mg / kg / d BID) plus PZQ (50mg / kg / d BID). The second group (Arm 2) is randomized to receive the same ABZ course (15 mg / kg / d BID) but not the PZQ. Instead of the PZQ they will receive a PZQ placebo to keep the study blind. The study will be conducted in Lima, Peru in the Cysticercosis Unit of the Peruvian University Cayetano Heredia. Patients will be recruited both at the National Institute of Neurologic",II,Peru,,,,,,,"Inclusion criteria: <br>1. Men and women between 16 and 65 years of age, with a diagnosis of viable cerebral parenchymal cysticercosis with 20 or fewer viable cysts detected by MRI and CT, and confirmed by Western Blot serology.<br>2. Patients with a diagnosis of epilepsy secondary to NCC and a history of one or more spontaneous seizures in the previous year and no more than 10 years.<br>3. Willingness to complete the minimum of two weeks of hospitalization required.<br>4. If the patient is a woman of childbearing age, negative urine tests and the willingness to use an adequate contraceptive method.<br>5. Normal values of hemoglobin, platelet count, white cell count, glucose and normal or decreased values of GOT, TGP, creatinine.<br>6. Negative PPD and, if positive, sputum results for TB, negative.<br>7. Negative stool test for Taenia eggs or Strongyloides larvae.<br>","Exclusion criteria: <br>1. Generalized Primary Epilepsy.<br>2. History of generalized epileptic status.<br>3. Type of NCC that exposes the patient to greater risks during the study.<br>4. Patients with persistent or progressive endocranial hypertension (HTE) or intracranial hypertension defined radiologically by CT or MRI.<br>5. Previous therapy with ABZ or PZQ in the last two years.<br>6. Pulmonary tuberculosis evidenced by chest x-ray and positive results of sputum, or signs compatible with tuberculosis infection.<br>7. Individuals with positive markers for active hepatitis.<br>8. Systemic disease distinct from NCC that may affect treatment or short-term prognosis.<br>9. Patients with unstable condition.<br>10. Pregnancy during the antiparasitic treatment.<br>11. History of hypersensitivity to ABZ or PZQ.<br>12. Simultaneous treatment with cimetidine or theophylline.<br>13. Chronic alcohol or drug abuse.<br>14. Inability or non-availability to perform a CT scan at the beginning of the study or an MRI at the sixth month.<br>15. Inability or non-availability of the subject or agent / legal representative in giving written informed consent.<br>","-B690 Cysticercosis of central nervous system <br>Cysticercosis of central nervous system;B690;Cysticercosis of central nervous system","<br>Group name:ARM 1 Type of group;1 N° of participants:90 Intervention(s) description:This group will be treated with Albendazole, in 200 mg tablets, at a dose of 15 mg / kg / day, PO, BID + Praziquantel, in 600 mg tablets, at a dose of 50 mg / kg / day, PO, IDB ; This scheme will be administered for 10 days.<br>Group name:ARM 2 Type of group;2 N° of participants:90 Intervention(s) description:This group will be treated with Albendazole, in 200 mg tablets, at a dose of 15 mg / kg / day, PO, BID + Praziquantel Placebo, in tablets, PO, BID; This scheme will be administered for 10 days.<br>","<br>Outcome name:Cerebral nuclear magnetic resonance (NMR), with contrast.<br>Measure:Proportion of parasites dying after a course with antiparasitic therapy.<br>Timepoints:6 months after starting therapy.<br>","<br>Outcome name:Criterion 1: Absence of viable cysts or degeneration in the evaluation by contrasting MRI. The calcifications may be visible, but they are not defined as cystic structures.<br>Criterion 2: Number of seizures (partial or with secondary generalization) during follow-up.<br>Criterion 3: Determination of serum levels of ABZ sulfate (ABZSO4) and its correlation with brain MRI lesions.<br>Criterion 4: Proportion of previous viable cysts that resolved and that are observed as radiological calcifications in the follow-up CT.<br>Measure:1) Radiological cure. 2) Cumulative incidence of seizures. 3) Relationship between ABZSO4 levels and cysticide efficacy. 4) Proportion of calcified lesions.<br>Timepoints:Criterion 1: At 6 months after treatment.<br>Criterion 2: Follow-up at 18 months.<br>Criterion 3: Days 4 and 7.<br>Criterion 4: One year after treatment.<br>;<br>Outcome name:Criterion 1: Clinical and imaging evaluation of CVD.<br>Criterion 2: Determination of the number of patients dying from any cause.<br>Criterion 3: Evaluation of neurological symptoms, such as seizures, intracranial hypertension and others.<br>Measure:Complications of the disease: 1) Frequency of cerebrovascular disease. 2) Mortality in the first 18 months of follow-up. 3) Proportion of patients presenting neurological symptoms.<br>Timepoints:When the event is presented.<br>"," NA",,,Approved;Approved;Approved;Approved,15/07/2010;17/06/2010;01/06/2010;07/12/2006,"Hospital Cayetano Heredia;Hospital Nacional Edgardo Rebagliati Martins;Hospital Nacional Guillermo Almenara Irigoyen - EsSalud;Universidad Peruana Cayetano Heredia"," Av. Honorio Delgado Nº 262;Av. Edgardo Rebagliati No 490; Av. Grau 800; Av. Honorio Delgado 430 Urb. I","97254626; 2654901-3080     2640516;999436950;3190000 anexo 2271","manglar10@yahoo.com ;jucam@amauta.rcp.net.pe ;demetrio.molero@essalud.gob.pe ;hguerra@upch.edu.pe ",,,,NA,,,,,,,Undecided,,Yes,False,"          "
PER-075-05,"4 September 2023","EFFECT ON THE FREQUENCY OF CONVULSIVE CRISES OF THE REINFORCED DOSAGE OF CORTICOIDS IN THE TREATMENT OF INTRAPARENQUIMAL NEUROCYSTICERCOSIS","EFFECT ON THE FREQUENCY OF CONVULSIVE CRISES OF THE REINFORCED DOSAGE OF CORTICOIDS IN THE TREATMENT OF INTRAPARENQUIMAL NEUROCYSTICERCOSIS                                                                                                                                                                                                                                                                                                                                                                                                                                                                                                                                                                                                                                                                                                                                                                                                                                                                                                                                                                   ",,"Instituto Nacional de Salud de los EE.UU (NIH-US),",18/01/2006,"  20060118","10/13/2025 16:04:25",REPEC,https://www.ins.gob.pe/ensayosclinicos/rpec/recuperarECPBNuevoEN.asp?numec=075-05,"Not Recruiting",No,0,0,--,01/01/1900,0,Interventional,"<br>			610/5000<br>			This trial is an open randomized study designed to compare the effectiveness of a longer course of corticosteroids used to suppress seizures induced by anthelmintic treatment in neurocysticercosis. Adults with one or more viable intraparenchymal cysts and with a history of seizures in the last 6 months will be selected. On day 42 of the study, at 3 months and a year, the number of generalized convulsive seizures and partial seizures, the proportion of patients with seizures and side effects will be compared between the two groups.<br>		",III,Peru,,,,,,,"Inclusion criteria: <br>1) Diagnosis of intraparenchymal NCC with 1 to 20 viable cysts.<br>2) Positive serology for cysticercosis by means of the Western Blot test (EITB).<br>3) Adult male or female between 18-65 years of age.<br>4) Patients with a diagnosis of epilepsy secondary to NCC.<br>5) Willingness to be hospitalized for a minimum of two weeks and for a longer time should complications occur.<br>6) Normal laboratory values for the study population.<br>7) Absence of signs of intracranial hypertension.<br>8) Negative stool test for tapeworm eggs.<br>9) Measurement of PPD and if it is positive: serial sputum negative for TB.<br>10) Willingness to use a method for birth control.<br>","Exclusion criteria: <br>1) Primary generalized seizures.<br>2) Patients with subarachnoid or ventricular NGC.<br>3) Any vesicular lesion greater than 2 centimeters in diameter.<br>4) Previous therapy with ABZ or PZQ within the last 2 years.<br>5) Intracranial hypertension.<br>6) History of epileptic status.<br>7) Focal neurological deficits.<br>8) Unstable vital signs.<br>9) Cysts in critical regions including the mesencephalon and the eye.<br>10) Pulmonary tuberculosis.<br>11) History of TB in the patient or history of TB not treated in any close contact, with whom the participant was living.<br>12) Chest x-ray suggestive of past or present TB.<br>13) Diabetes pre-existing diagnosis.<br>14) Other systemic conditions that may affect the therapy or prognosis of NGC in the short term.<br>15) Participant who presents a concomitant disease that compromises their survival during the first year.<br>16) Pregnancy during treatment with ABZ.<br>17) No availability or inability to perform an MRI exam.<br>18) Unavailability or inability to perform a CT scan or MRI at the beginning of the study at 6 months, a CT scan at the end of the study or after delivery if the participant was pregnant.<br>19) History of hypersensitivity to ABZ, antiepileptic drugs or contrast material.<br>20) Breastfeeding during treatment.<br>21) Hypertension at rest.<br>22) Patient is currently receiving corticosteroids, which has received this treatment within the last 4 weeks.<br>23) Other CNS processes that may be confused with changes in CNS function due to cysticercosis.<br>","-B690 Cysticercosis of central nervous system <br>Cysticercosis of central nervous system;B690;Cysticercosis of central nervous system","<br>Group name:ARM A Type of group;1 N° of participants:55 Intervention(s) description:This group will be treated with Albendazole 15 mg / kg / day VO BID (maximum dose 1200 mg) for 14 days. Dexamethasone 2 mg VO TID for 10 days, discontinuing without tapering.<br>Group name:ARM B Type of group;2 N° of participants:55 Intervention(s) description:This group will be treated with Albendazole 15 mg / kg / day VO BID (maximum dose 1200 mg) for 14 days. Dexamethasone 8 mg VO divided into 3 doses every 8 hours for 4 weeks, with tapering of 4 days.<br>","<br>Outcome name:Clinical evaluation.<br>Measure:Cumulative frequency of partial, generalized seizures and total seizure frequency between days 11 and 42.<br><br>Timepoints:Days 1, 7, 10, 14, 21, 28, 30, 32, 34, 36, 38, 42.<br>","<br>Outcome name:Clinical evaluation.<br>Brain CT or MRI. The resonance will minimally include a coronal, axial and sagittal image in T1 and in the FLAIR sequence.<br>Measure:Cumulative frequency of partial, generalized seizures and total seizure frequency between days 43 and 90 and between days 90 and 360. Proportion of seizure-free patients between days 90 and 360. Proportion of patients free of viable cysts between days 180 and 360. Proportion of patients with viable cysts between days 180 and 360. Proportion of patients who required a second antiparasitic treatment.<br>Timepoints:Clinical evaluation: Days 1, 7, 10, 14, 21, 28, 30, 32, 34, 36, 38, 42, 60, 90, 180, 270, 360.<br>CT or MRI: At the beginning of the study and on days 180 and 360.<br>;<br>Outcome name:Clinical evaluation.<br>Hematology panel. Panel of serum chemistry.<br>Measure:Safety of treatment: Adverse effects of albendazole, dexamethasone, phenytoin. Laboratory exams.<br><br>Timepoints:Clinical evaluation: Days: 7, 10, 14, 21, 28, 30, 32, 34, 36, 38, 42, 60, 90, 180, 270, 360.<br>Laboratory tests: Day 1, 10, 14, 21, 28, 34, 42, 60.<br>"," NA",,,Approved,03/10/2005,"Universidad Peruana Cayetano Heredia"," Av. Honorio Delgado 430 Urb. I","3190000 anexo 2271","hguerra@upch.edu.pe ",,,,NA,,,,,,,Undecided,,Yes,False,"          "
NCT00133458,"12 December 2020","RCT ALB for SA Cysticercosis","Randomized, Double Blind Comparison of Two Lenghts of Albendazole Therapy for Subarachnoid Cysticercosis",,"National Institute of Allergy and Infectious Diseases (NIAID)",19/08/2005,"  20050819","10/13/2025 16:04:25",ClinicalTrials.gov,https://clinicaltrials.gov/show/NCT00133458,"Not recruiting",No,"18 Years","65 Years",All,01/09/2005,0,Interventional,"Allocation: Randomized. Intervention model: Parallel Assignment. Primary purpose: Treatment. Masking: Double. ","Phase 3",Brazil;Colombia;Ecuador;Peru;Brazil;Colombia;Ecuador;Peru,,,,,,,"<br>    Inclusion Criteria:<br><br>     - Male or female individuals between 18-65 year of age with a diagnosis of basal<br>       subarachnoid cysticercosis, based on MRI and confirmed by serological test.<br><br>     - Willingness to accomplish the two weeks minimal hospitalization required.<br><br>     - Female of child-bearing potential willing to use an adequate method of contraception<br>       including implants, injectables, combined oral contraceptives, effective intrauterine<br>       devices, sexual abstinence, or vasectomized partner while participating in the study.<br><br>     - Patients with normal laboratory values for hemoglobin, platelet counts, total white<br>       blood cells, glucose, creatinine, bilirubin, ALT, AST, and electrolytes.<br><br>     - Negative fecal exam for Taenia eggs.<br><br>    Exclusion Criteria:<br><br>     - Previous therapy with albendazole (does not include patients who received single-dose<br>       400 mg ABZ for intestinal parasites), or praziquantel.<br><br>     - Pulmonary tuberculosis evidenced by a positive chest X-ray and positive sputum smears.<br><br>     - Pre-existing diagnosis of diabetes<br><br>     - Systemic disease other than NCC that may affect therapy or short-term prognosis,<br>       including but not limited to chronic renal failure, hepatic insufficiency, cardiac<br>       failure, and steroid-dependent immune diseases. Identification of systemic diseases<br>       will be left to the discretion of each Site PI.<br><br>     - Patients in unstable condition or with severe intracranial hypertension (ICH).<br>       Definition of severe ICH for this study would be the presence of headaches, nausea,<br>       and vomiting and papilledema at fundoscopic examination (all of them). Patients in<br>       this category can be considered for entrance into the study only after treatment of<br>       ICH by ventricle-peritoneal shunting. Patients with CT findings compatible with<br>       intracranial hypertension will have neurosurgical evaluation (by non study personal)<br>       before study entry.<br><br>     - Pregnancy<br><br>     - History of hypersensitivity to albendazole<br><br>     - Concurrent treatment with praziquantel, cimetidine or teophylline.<br><br>     - Chronic alcohol or drug abuse<br>   ",,"Subarachnoid Cysticercosis","Drug: Albendazole",,,04-003,"Please refer to primary and secondary sponsors",,,,,,,,,,,,,,,,,,,,Yes,False,"          "
PER-002-05,"4 September 2023","ELIMINATION OF CYSTICERCOSIS IN PERU","ELIMINATION OF CYSTICERCOSIS IN PERU                                                                                                                                                                                                                                                                                                                                                                                                                                                                                                                                                                                                                                                                                                                                                                                                                                                                                                                                                                                                                      ",,"BILL & MELINDA GATES FOUNDATION,",07/02/2005,"  20050207","10/13/2025 16:04:25",REPEC,https://www.ins.gob.pe/ensayosclinicos/rpec/recuperarECPBNuevoEN.asp?numec=002-05,"Not Recruiting",No,0,0,--,24/10/2012,160000,Interventional,"It is a multicenter, non-randomized, openstudy of parallel groups to evaluate the effectiveness of cysticercosis and taeniasis control strategies based on tools that include: identification, mass treatment and targeted treatment in human and porcine population",0,Peru,MONICA,VERA,Alan,mvera@,"993520629/ 3288589","UNIVERSIDAD PERUANA CAYETANO HEREDIA ","Inclusion criteria: <br>- Resident of the rural areas of Tumbes, Talara and Sullana (who stays at least two nights in the<br>community)<br>- Resident over two years.<br>","Exclusion criteria: <br>- Residents who refuse to participate in the study.<br>- Women in gestation will not receive massive treatment of niclosamide.<br>- Participants with a history of adverse effects to nidosamide will not participate in the mass treatment.<br>","-B68 Taeniasis-B690 Cysticercosis of central nervous system <br>Taeniasis <br>Cysticercosis of central nervous system;B68 ;B690;Taeniasis;Cysticercosis of central nervous system","<br>Group name:Year 1, minimum intervention model. Group of Humans Type of group;1 N° of participants:2400 Intervention(s) description:This group will be treated with massive treatments of Niclosamide 1 to 2 g PO according to weight (Children between 11 and 34 kg: 1 g, Children over 34 kg: 1.5 g, Adults: 2 g), every 4 months for a total of 2 doses The treatment of this group will begin 1 month after the treatment of the pigs of the same communities.<br>Group name:Year of Stagnation 2. Population of Talar and Sullana<br>Type of group;1 N° of participants:60000 Intervention(s) description:In human population: Three rounds of mass treatment of taeniasis with niclosamide 1 to 2 g PO QD according to weight will be applied (Children between 11 and 34 kg: 1 g, Children over 34 kg: 1.5 g, Adults: 2 g) , months 1, 5 and 9.<br><br>In swine population Five rounds of massive treatment with Oxfendazole at maximum dose PO, months 0, 2, 4, 6, and 8. Recombinant vaccine TS0L18 IM months 0 and 4. Vaccine against swine cholera months 0, 2 and 4 .<br>","<br>Outcome name:Application of 6 different models for the control of taeniasis in human and porcine population. After this the 2 most successful models of intervention are applied at large scale<br>Measure:Development and evaluation of a new control strategy for the treatment of taeniasis and human and porcine neurocysticercosis<br>Timepoints:48 months<br>","<br>Outcome name:Serological samples in blood, urine and faeces in humans and swine population: Western Blot technique to detect antibodies against teniosis. Concentration technique for the detection of eggs. Copro antigen technique.<br>Necropsy of swine population.<br><br>Measure:Demonstration of the interruption of the transmission of T. solium.<br>Timepoints:The samples of blood, feces, urine both porcine and human were taken according to the different calendars of each of the 6 models during the 4 years of intervention. Samples could be taken before or after the administration of treatment.<br>;<br>Outcome name:Determination of incidence and prevalence of epileptic seizure events in the study area and through periodic monitoring of the incidence and prevalence of porcine cysticercosis seropositivity in Western Blot tests to detect antibodies against teniosis, of concentration for the detection of eggs, co-antigen test and necropsy of porcine population.<br><br>Measure:Impact of the intervention<br>Timepoints:An evaluation will be made after the intervention during each year to estimate the prevalence and incidence of taeniasis and human or porcine cysticercosis.<br>The samples of blood, feces, urine both porcine and human were taken according to the different calendars of each of the 6 models during the 4 years of intervention. They can be taken before or after the administration of treatment.<br>;<br>Outcome name:Efficacy of the treatment: Seropositivity in the Western Blot, egg concentration, coproantigen and necropsy tests of the swine population.<br>Economic impact: Socio-economic census that will include characteristics of geographical location, characteristics of housing, family members, raising pigs and other animals, characteristics and location of breeding sites, breeding conditions, type of feeding and water status .<br>Measure:<br>776/5000<br>Efficacy of the treatment. Economic impact of the interventions.<br><br>Timepoints:The samples of blood, feces, urine both porcine and human were taken according to the different calendars of each of the 6 models during the 4 years of intervention.<br>The impact survey is carried out before each intervention.<br>;<br>Outcome name:Survey to determine the prevalence of epilepsy in all the villages intervened.<br>Neurological evaluation Electroencephalogram. Serum, faeces and urine samples for detection of T. solium infection.<br>Quality of life survey.<br>Measure:Prevalence of epilepsy. Etiology of seizures. Impact on the quality of life in patients with a diagnosis of epilepsy.<br>Timepoints:These interventions will be carried out during Year 1.<br>",,,,Approved;Approved,03/09/2006;16/04/2013,"Universidad Peruana Cayetano Heredia;Universidad Peruana Cayetano Heredia"," Av. Honorio Delgado 430 Urb. I; Av. Honorio Delgado 430 Urb. I","3190000 anexo 2271;3190000 anexo 2271","hguerra@upch.edu.pe ;hguerra@upch.edu.pe ",,,,NA,,,,,,,No,,Yes,False,"          "
