PACTR201811769142678,"24 June 2025","Effectiveness of a locally developed health education package in the control of Taenia solium infections in humans and pigs in Tanzania","Development and evaluation of a locally adapted health education package for control of Taenia solium taeniasis and cysticercosis in Tanzania                                                                                                                                                                                                                                                                                                                                                                                                                                                                                                                                                                                                                                                                                                                                                                                                                                                                                                                                                                  ",,"Helena A. Ngowi",30/11/2018,"  20181130","10/13/2025 16:04:25",PACTR,https://pactr.samrc.ac.za/TrialDisplay.aspx?TrialID=3559,"Not Recruiting",No,"6 Year(s)","12 Year(s)",Both,01/01/2019,1462,Interventional,"Parallel: different groups receive different interventions at same time during study,Non-randomised,Allocation was determined by the holder of the sequence who is situated off site",Phase-3,"United Republic of Tanzania;United Republic of Tanzania",Ernatus,Mkupasi,"Sokoine University of Agriculture, P. O. Box 3021",emkupasi@yahoo.com,+255763929,Lecturer,"Inclusion criteria: Residing in the study districts (Kongwa and Songwe), Tanzania<br>Aged 6-65 years<br>Willing to participate","Exclusion criteria: Residing outside the study districts (Kongwa and Songwe), Tanzania<br>Aged below 6 or above 65 years<br>Unwilling to participate"," <br>Digestive System <br>Musculoskeletal Diseases <br>Nervous System Diseases <br>Skin and Connective Tissue Diseases;Digestive System;Musculoskeletal Diseases;Nervous System Diseases;Skin and Connective Tissue Diseases",";Health education;Monitoring alone","Cumulative incidence of Taenia solium cysticercosis seroconversion in humans compared between the intervention and control groups.","Change in knowledge, attitudes and practices related to Taenia solium.;Change in the prevalence of cysticercosis in pigs",NIMRHQR.8aVol.IX2802,"German Federal Ministry of Education and Research BMBF",,Approved;Approved,22/06/2018;17/07/2017,"National Institute for Medical Research;Research Innovation and Publication Committee","3 Barack Obama Drive;Sokoine University of Agriculture",+255222121400;+255232603511,ethics@nimr.or.tz;deanfvm@sua.ac.tz,,,,,,,,,,,No,,Yes,False,"          "
PACTR201712002788898,"24 June 2025","Evaluation of an antibody detecting point-of-care test for the diagnosis of Taenia solium taeniosis and (euro)cysticercosis in Tanzania and Zambia","Evaluation of an antibody detecting point-of-care test for the diagnosis of Taenia solium taeniasis and (neuro)cysticercosis in communities and district hospitals of highly endemic, resource-poor areas in sub Saharan Africa, including capacity building                                                                                                                                                                                                                                                                                                                                                                                                                                                                                                                                                                                                                                                                                                                                                                                                                                                                                                          ",,"Institute of Tropical Medicine",21/11/2017,"  20171121","10/13/2025 16:04:25",PACTR,https://pactr.samrc.ac.za/TrialDisplay.aspx?TrialID=2788,"Not Recruiting",No,"10 Year(s)","140 Year(s)",Both,02/12/2017,3800,Interventional,"Parallel: different groups receive different interventions at same time during study,Randomised,Diagnostic study with randomised and non-randomised part, randomisation based on household codes, tallying and coin-tossing,NA, diagnostic study","Not Applicable",Zambia;Tanzania;Tanzania;Tanzania,Sarah,GABRIEL," Salisburylaan 133",sarah.gabriel@ugent.be,+3292647737,"Ghent University","Inclusion criteria: Tanzania NCC:<br>Patients 10 years of age and above with on-going symptoms of severe progressive headache impeding the daily activities without fever and without signs of cerebral infection or other obvious causes OR patients 10 years of age and above with a history of one or more epileptic seizures without obvious causes<br>¿ Patients willing and able to participate in all aspects of the study, including providing blood and stool samples, participating in a questionnaire survey, and undergoing brain<br>CT Scan if indicated<br>¿ Patients willing and able to provide written informed consent<br>¿ Patients living in the study area for the past three months and planning to stay in the same area throughout the study period<br>Tanzania T:<br>Patient must be 10 years and above and present at the out-patient clinic with<br>(1) intestinal complaints compatible with intestinal worm infection (diarrhoea > 2 weeks and/or abdominal pain/discomfort > 2 weeks and/or recent history of worm expulsion): SELECTIVE GROUP<br>(2) any other symptom not immediately linked with intestinal worm infection: RANDOM GROUP <br>¿ Patients willing and able to provide written informed consent<br>¿ Patients living in the study area for the past three months and planning to stay in the same area throughout the study period<br>Zambia (N)CC and T: <br>Patients willing and able to participate in all aspects of the study, including providing blood and stool samples, participating in a questionnaire survey, and undergoing brain CT scan if indicated <br>¿ Willing and able to provide written informed consent <br>Living, attending school, or regularly visiting the bore holes present in the study<br>communities<br>¿ Aged 10 years of age or older<br>PhD study:<br>Individuals involved in the preparation of pork and that usually also eat pork<br>¿ Individuals older than 18 years of age<br>¿ Individuals willing and able to provide written informed consent<br> ","Exclusion criteria: Tanzania NCC: <br>¿ Patients less than 10 years of age<br>¿ Patients with any acute febrile illness<br>¿ Patients with fever and signs and symptoms for middle ear infection<br>¿ Patients with signs and symptoms of meningitis<br>¿ Patients with neck muscle pain and stiffness<br>¿ Patients with a history of stroke with neurological focal deficit<br>¿ Patients not willing or able to provide written informed consent (assent for minors)<br>¿ Patients not resident in the study area<br>¿ Patients reported pregnant<br>Tanzania T: <br>Patients below the age of 10 years<br>¿ Patients with acute severe illness that need in-patient care<br>¿ Patients not willing or able to provide written informed consent (assent for minors)<br>¿ Patient not resident in the study area<br>Zambia:<br>Unwilling or unable to participate in some or all aspects of the study, including<br>providing blood and stool samples, participating in a questionnaire survey, and<br>undergoing brain CT scan if indicated (clinically or per protocol)<br>¿ Unwilling or unable to provide written informed consent (assent for minors with<br>consent from a parent or a legally authorised representative)<br>¿ Living outside of, and not regularly visiting, or attending school in, the study<br>communities<br>¿ Children below the age of 10 years<br>¿ Children below the age of 10 years with severe malnutrition<br>¿ Reported pregnant<br>Seriously ill (unable to engage in the normal activities of daily living without<br>assistance because of the illnesses)<br>PhD:<br>Individuals below the age of 18 years<br>¿ Individuals not willing or able to provide written informed consent<br>¿ Individuals that previously participated in T. solium research projects"," <br>neurocysticercosis, taeniosis <br>neurocysticercosis, taeniosis;neurocysticercosis, taeniosis;neurocysticercosis, taeniosis",";Diagnostic study Tanzania;Diagnostic study Zambia","POC test sensitivity and specificity for the detection of taeniosis and (neuro) csyticercosis at community level (Zambia) and at district hospital level (Tanzania)","Tanzania: Behavioural change following health education",,"EDCTP;Bundesministerium fur Bildung und Forschung BMBF",,Approved;Approved;Approved,13/09/2017;18/09/2017;10/10/2017,"University of Zambia Biomedical Research Ethics Committee;Universiteit Antwerpen Ethisch Comite;National Health Research Ethics CommitteeNational Institute for Medical Research"," University of Zambia, Ridgeway Campus, POBox 50110 Lusaka, Zambia;UZA, Wilrijkstraat 10; 3 Barack Obama Drive",+260012560670;+323813000;+255222121400,unzarec@unza.zm;etisch.comite@uza.be;ethics@nimr.or.tz,,,,,,,,,,,,,Yes,False,"          "
NCT03095339,"12 December 2020","EFECAB: Improving Pig Management to Prevent Epilepsy in Burkina Faso","EFECAB: Improving Pig Management to Prevent Epilepsy in Burkina Faso",EFECAB,"University of Oklahoma",22/03/2017,"  20170322","10/13/2025 16:04:25",ClinicalTrials.gov,https://clinicaltrials.gov/show/NCT03095339,"Not recruiting",No,"5 Years",N/A,All,21/02/2011,58,Interventional,"Allocation: Randomized. Intervention model: Parallel Assignment. Primary purpose: Prevention. Masking: None (Open Label). ",N/A,"Burkina Faso"," ","Hélène Carabin, DVM PhD",,,,"University of Oklahoma","<br>    The unit of randomization and analysis of this study is the village. Therefore, the<br>    eligibility criteria were determined at the village level.<br><br>    Inclusion Criteria:<br><br>     - Population of at least 1000 at the 2006 census<br><br>     - Present on the map of the """"Institut Géographique du Burkina 2000""""<br><br>     - Separated from another village by at least 5 kilometers.<br><br>    Exclusion Criteria:<br><br>     - Village located on a National or Provincial road<br><br>     - Village located within 20 km of Koudougou or Ouagadougou<br><br>     - Regional or Provincial Capital<br><br>     - Absence of pigs in the village<br><br>    At the individual level, the following eligibility criteria were used:<br><br>    Inclusion Criteria:<br><br>     - Aged 5 years old or more<br><br>     - Has lived in the village for at least 12 months<br><br>     - Not planning to move in the next three years<br><br>    Exclusion Criteria:<br><br>     - Presence of confirmed epilepsy or progressively worsening severe chronic headaches at<br>       baseline.<br>   ",,Cysticercosis,"Other: Educational package","Human active cysticercosis cumulative incidence","Porcine active cysticercosis prevalence;Change in knowledge, attitude and practices;Cumulative incidence of epilepsy and progressively worsening severe chronic headaches;Stigmatization of epilepsy",1419,"Please refer to primary and secondary sponsors","AFRICSanté;Institute of Tropical Medicine, Belgium;Institut de Recherche en Sciences de la Sante, Burkina Faso;University of Ouagadougou, Burkina Faso;University Hospital, Limoges;Centre Universitaire Souro Sanou;Technische Universität München;Brown University",,,,,,,,,,,,,,,,,Yes,"De-identified data will be made available at the time of publication as per NIH requirements",No,False,"          "
NCT02947581,"21 November 2022","Sub Arachnoid Neurocysticercosis Treatment Outcome (SANTO)","A Randomized Trial of Combined Albendazole Plus Praziquantel for Subarachnoid Cysticercosis of the Sylvian Fissure or the Basal Cisterns",SANTO,"Universidad Peruana Cayetano Heredia",24/10/2016,"  20161024","10/13/2025 16:04:25",ClinicalTrials.gov,https://clinicaltrials.gov/show/NCT02947581,"Not recruiting",No,"18 Years","65 Years",All,14/11/2016,107,Interventional,"Allocation: Randomized. Intervention model: Parallel Assignment. Primary purpose: Treatment. Masking: Double (Participant, Investigator). ","Phase 3",Peru," ","Hector H. Garcia Lescano, Ph.D",,,,"Universidad Peruana Cayetano Heredia","<br>    Inclusion Criteria:<br><br>     - - Male or female adult individuals (18 to 65 y.o.) with a diagnosis of basal<br>       subarachnoid cysticercosis (including locations in the Sylvian fissure or lower<br>       interhemispheric spaces) by neuroimaging and confirmed by serology.<br><br>     - Baseline laboratory results along acceptable ranges (specifically defined in the study<br>       protocol).<br><br>     - Willingness to accomplish the two-week minimum hospitalization required.<br><br>    Exclusion Criteria:<br><br>     - Previous therapy with ABZ or PZQ in the preceding 3 years (except for patients who<br>       received single-dose ABZ for intestinal parasites, or patients who received<br>       antiparasitic treatment between one and three years before enrollment but demonstrated<br>       lesion persistence or progression during the past 12 months).<br><br>     - A type of NCC which can expose the patient to increased risk during the study,<br>       specifically: a) intraventricular cysts; b) cysts in brainstem; c) concomitant<br>       intraparenchymal lesions greater than 3 cm of diameter in addition to their SANCC<br>       lesions; d) more than 20 intraparenchymal cysts in addition to their SANCC lesions; or<br>       d) untreated ocular cysticercosis. Patients with a lateral ventricle cyst, less than 2<br>       cm in diameter, without hydrocephalus or intracranial hypertension, can be included.<br>       The presence of concomitant intraparenchymal cysts of less than 3 cm in diameter will<br>       not exclude the patient unless there are more than 20 of them.<br><br>     - Active pulmonary tuberculosis evidenced by positive chest X-ray and positive sputum<br>       smears, or symptoms compatible with tuberculosis (fever+sweats or fever+cough) not<br>       otherwise explained.<br><br>     - Individuals with positive markers for active hepatitis.<br><br>     - Systemic disease that may affect therapy or short-term prognosis, including but not<br>       limited to chronic renal failure, hepatic insufficiency, cardiac failure, and<br>       steroid-dependent immune diseases.<br><br>     - Patients in unstable condition or with symptomatic intracranial hypertension (ICH).<br>       Definition of symptomatic ICH for this study is the presence of headaches, nausea, and<br>       vomiting, with papilledema at fundoscopic examination. Patients in this category can<br>       be considered for entrance into the study only after resolution of ICH by<br>       ventricular-peritoneal shunting or neuroendoscopic procedures involving CSF flow<br>       derivation. These procedures would be done as part of their standard medical care and<br>       are not part of the trial intervention.<br><br>     - Pregnancy during anti-parasitic treatment. If a patient becomes pregnant after<br>       treatment, she will continue in the study but will have radiological exams delayed<br>       until after delivery.<br><br>     - History of hypersensitivity to ABZ or PZQ<br><br>     - Chronic or drug abuse as defined in the study protocol.<br><br>     - Unwilling or unable to undergo MRI exams (like patients with ferromagnetic implants)<br><br>     - Inability or unwillingness of subject or legal representative to give written informed<br>       consent.<br>   ",,Neurocysticercosis,"Drug: Albendazole and praziquantel;Drug: Albendazole and praziquantel placebo","Radiological efficacy at three months (3-month improvement).","Radiological efficacy at six months (marked improvement or """"radiological cure"""") (evaluated only in patients with improvement at month 3).;Effect persistence at 12 months (no relapse) (evaluated only in patients with marked improvement at month 6) Effect persistence at 12 months (no relapse) (evaluated only in patients with marked improvement at month 6);Clinically asymptomatic patient;Decrease in serum levels",61449,"Please refer to primary and secondary sponsors",,,,,,,,,,,,,,,,,,,,Yes,False,"          "
PER-023-16,"13 November 2023","A RANDOMIZED TRIAL OF COMBINED ALBENDAZOLE PLUS PRAZIQUANTEL FOR SUBARACHNOID CYSTICERCOSISOF THE SYLVIAN FISSURE OR THE BASAL CISTERNS","A RANDOMIZED TRIAL OF COMBINED ALBENDAZOLE PLUS PRAZIQUANTEL FOR SUBARACHNOID CYSTICERCOSISOF THE SYLVIAN FISSURE OR THE BASAL CISTERNS                                                                                                                                                                                                                                                                                                                                                                                                                                                                                                                                                                                                                                                                                                                                                                                                                                                                                                                                                            ",,"UNIVERSIDAD PERUANA CAYETANO HEREDIA,",02/08/2016,"  20160802","10/13/2025 16:04:25",REPEC,https://www.ins.gob.pe/ensayosclinicos/rpec/recuperarECPBNuevoEN.asp?numec=023-16,"Not Recruiting",No,,,Both,01/08/2016,136,Interventional,"Double-blind, randomized, placebo-controlled study in patients with subarachnoid cysticercosis of the basal cisterns or the Sylvian fissure comparing in two parallel arms the efficacy of the standard of care anti-parasitic regime (30 days of ABZ at 15 mg/k/d, up to 1200 mg/k/d) with a combined regime using  ABZ 15 mg/k/d, up to 800 mg/d for the days 1 to 20, up to 1200 mg/d for the days 21 - 30  and adding PZQ at 50 mg/k/d for the initial 15 days of anti-parasitic treatment.",III,Peru,"Hector Hugo",Garcia,"Av. Honorio Delgado -SMP",hgarcia1@jhsph.edu,3288589,"UNIVERSIDAD PERUANA CAYETANO HEREDIA ","Inclusion criteria: <br>- Male or female adult individuals (18 to 65 y.o.) with a diagnosis of basal subarachnoid cysticercosis (including locations in the Sylvian fissure or lower interhemispheric spaces) by neuroimaging and confirmed by serology.<br>- Baseline laboratory results along acceptable ranges (specifically defined in the study protocol).<br>- Willingness to accomplish the two-week minimum hospitalization required.<br><br>Patients will be considered eligible for the study if they have NCC involving the basal cisterns, the interhemispheric brain space, or the Sylvian fissure on baseline CT or MRI. Patients with only small subarachnoid lesions (<20mm in diameter) in the convexity of the brain hemispheres will not be included because these lesions commonly respond well to therapy and behave as intraparenchymal lesions.<br>","Exclusion criteria: <br>- Previous therapy with ABZ or PZQ in the preceding 3 years (except for patients who received single-dose ABZ for intestinal parasites, or patients who received antiparasitic treatment between one and three years before enrollment but demonstrated lesion persistence or progression during the past 12 months).<br>- A type of NCC which can expose the patient to increased risk during the study, specifically: a) intraventricular cysts; b) cysts in brainstem; c) concomitant intraparenchymal lesions greater than 3 cm of diameter in addition to their SANCC lesions; d) more than 20 intraparenchymal cysts in addition to their SANCC lesions; or d) untreated ocular cysticercosis. Patients with a lateral ventricle cyst, less than 2 cm in diameter, without hydrocephalus or intracranial hypertension, can be included. The presence of concomitant intraparenchymal cysts of less than 3 cm in diameter will not exclude the patient unless there are more than 20 of them.<br>- Active pulmonary tuberculosis evidenced by positive chest X-ray and positive sputum smears, or symptoms compatible with tuberculosis (fever+sweats or fever+cough) not otherwise explained.<br>- Individuals with positive markers for active hepatitis.<br>- Systemic disease that may affect therapy or short-term prognosis, including but not limited to chronic renal failure, hepatic insufficiency, cardiac failure, and steroid-dependent immune diseases.<br>- Patients in unstable condition or with symptomatic intracranial hypertension (ICH). Definition of symptomatic ICH for this study is the presence of headaches, nausea, and vomiting, with papilledema at fundoscopic examination. Patients in this category can be considered for entrance into the study only after resolution of ICH by ventricular-peritoneal shunting or neuroendoscopic procedures involving CSF flow derivation.<br>- Pregnancy during anti-parasitic treatment. If a patient becomes pregnant after treatment, she will continue in the study but will have radiological exams delayed until after delivery.<br>- History of hypersensitivity to ABZ or PZQ<br>- Chronic alcohol or drug abuse as defined in the study protocol.<br>- Unwilling or unable to undergo MRI exams (like patients with ferromagnetic implants)<br>- Inability or unwillingness of subject or legal representative to give written informed consent.<br>","-B690 Cysticercosis of central nervous system <br>Cysticercosis of central nervous system;B690","<br>Intervention - PZQ (50 mg/k/d, up to 3600 mg/d, for 15 days), as an add-on to ABZ treatment (15 mg/k/d, up to 800 mg/d for days 1-20, up to 1200 mg/d for days 21-30). In order to maintain the double blind nature of the trial, ABZ placebo will be administered to individuals over 53 kg of weight until completing the equivalent doses in the comparison group.<br><br>Comparison regime - PZQ placebo in similar doses, given during the initial 15 days of ABZ treatment at standard doses (15 mg/k/d up to 1200 mg/d for 30 days. In-hospital direct administration of oral tablets. Doses and duration will be: 15 mg/k/d of albendazole divided in two doses, for 30 days (both groups, with a lower ceiling in 800 mg for the combination arm during the concomitant administration of PZQ and for five more days and completed with ABZ placebo in individuals weighting more than 53 kg), and 50 mg/k/d/ of praziquantel, divided in two doses, for the initial 15 days (active drug in one group, identical placebo in the other).<br><br>Study subjects will receive an approximate of 50 mg/k/d of PZQ or PZQ placebo divided in two daily doses, morning and evening. PZQ comes in 600 mg tablets divided in four, so the dose will be rounded up to the next 150 mg level, up to a maximum of 3.6 g/d. ABZ, will be given at 15 mg/k/day divided in two daily doses, morning and evening. ABZ is supplied in 200 mg tablets so the dose will be rounded up to the next 100 mg level. All groups will receive ABZ active drug at 15 mg/k/d, with a ceiling in 1200 mg/d in the ABZ alone arm and a lower ceiling of 800 mg/d for the initial 20 days, completed with ABZ placebo in the combination arm. Drugs will be administered in the hospital, by the Study Nurse.<br>",,,,"The National Institute of Neurological Disorders and Stroke (NINDS),",,Approved;Approved;Approved,22/06/2016;02/12/2015;23/05/2014,"Hospital Cayetano Heredia;Instituto Nacional de Ciencias Neurologicas;Universidad Peruana Cayetano Heredia"," Av. Honorio Delgado Nº 262;Jr. Ancash 1271 ; Av. Honorio Delgado 430 Urb. I","97254626;998661763;3190000 anexo 2271","manglar10@yahoo.com ;mariamezavega@gmail.com;hguerra@upch.edu.pe ",Yes,,,,06/04/2021,,,,,,,,No,False,"          "
